Individual Crypto Hacks Done by Using Malware from Darknet: Chainalysis;Blockchain News
U.K. Banks Seek Technology Updates to Hold Off New Competitors;Finanzen.net
U.S. Senate Democrats fail in bid to pass voting rights bill;Reuters
Die Zukunft des Arbeitens  Die Reise hin zur OmniExperience;Capgemini
Union Bank of the Philippines to Enhance Crypto Trading & Custody Services;Blockchain News
Baby Doge Coin continues fantastic gains: top places to buy Baby Doge Coin now;CoinJournal
NFT platform Autograph Raises $170M in Series B funding;Blockchain News
Top places to buy MXC about to break $0.01 per token after exponential growth;CoinJournal
468 SPAC II SE notiert seit heute im Regulierten Markt in Frankfurt;Deutsche B«Ùrse
Kalkulation Pricing und Ertragsteuern in der Bankpraxis;msgGillardon
Zilliqa On The Verge Of Eliminating Another Zero Will DeFi And Metapolis Flareup The Bulls?;Coinpedia
Schweizer Kantone sind Spitzenreiter im internationalen Steuerwettbewerb;investrends
The rising tide of decentralization in mass movements;forkast
Crypto clampdowns mount in Asia as authorities ponder bans;forkast
MDEX One Year Anniversary: Marching forward from the É??oldÉ?ù DeFi story into the new chapters of Metaverse NFT and DAO;The Block
Hackerangriff: Daten von 515.000 Menschen erbeutet: Schwere Cyberattacke gegen Internationales Rotes Kreuz;Handelsblatt
Regulator calls for EUWide ban on Bitcoin mining citing wastage of renewable energy;Crypto News Flash
ESMA launches a Common Supervisory Action with NCAs on valuation of UCITS and openended AIFs;European Securities and Markets Authority (ESMA)
Verordnung «¨ber Massnahmen bei Erwerbsausfall im Zusammenhang mit dem Coronavirus (Covid19) (Covid19Verordnung Erwerbsausfall);Kompetenzzentrum Amtliche Ver«Ùffentlichungen (KAV)
Real Trump Token gaining steadily: hereÉ??s where to buy Real Trump Token today;CoinJournal
«?NDERUNGSANTR«?GE 010-011 - VORSCHLAG F«?R EINE EMPFEHLUNG DES EUROP«?ISCHEN PARLAMENTS AN DEN RAT UND DIE KOMMISSION nach der Pr«¨fung von behaupteten Verst«Ù«?en gegen das Unionsrecht und Missst«œnden bei dessen Anwendung im Zusammenhang mit dem Schutz von Tieren beim Transport innerhalb und au«?erhalb der Union - B9-0057/2022(010-011)/REV1;European Parliament (EP)
Backend Developer (mfd) at Allianz Digital Health GmbH;Allianz - Job Postings
Intern (mfd) in the ACM  Allianz Customer Model in Busine...;Allianz - Job Postings
Financial Reporting Consultant (mfd)  Group Accounting &...;Allianz - Job Postings
InternWorking Student in IT Product Portfolio & Commercial...;Allianz - Job Postings
Google New Team to Shape Blockchain Venture;Blockchain News
Ternoa: Rising NFT Blockchain Releases New Launchpad for Exciting Early Stage Participation in Quality DApps;Coindoo
Touchless planning  how to get there;Capgemini
Touchless planning  retaining hearts and minds;Capgemini
Touchless planning  getting started and the benefits;Capgemini
Goodbye supply chain  hello supplyvalue network;Capgemini
Canadian restaurant grabbed huge profit amid 80% downfall in sales: Bitcoin adoption;Bitcoinik
Opera Launches First Web3 Internet Browser Built for Blockchain and Crypto;DailyCoin.com
BitMEX Launches New Ways to EARN and CONVERT Crypto;TheNewsCrypto
BitMEX Launches New Ways to EARN and CONVERT Crypto;Crypto News Flash
Around 300 US banks will offer Bitcoin trading services: Report;Bitcoinik
Bitcoin Whales Add 40000 BTC in the Last 2 Days;Finance Magnates
Mars4 Metaverse NFT Sale Raises Over $250K in a Day: The WorldÉ??s First Virtual Mars NFTs Are Selling Rapidly;News.Bitcoin.com
Singapore Shuts down all Crypto ATMs Operation following Crypto Public Ads Prohibition Imposed;Blockchain News
Cardano Price On Bullish Track ! ADA To Hit $1.64 to $1.81 in Coming Days ?;Coinpedia
WhatÉ??s Next For BTC ETH and SOL Price ? Traders Watch These Levels!;Coinpedia
The SEC has issued $2.4B in cryptorelated penalties since 2013;Cointelegraph
Crypto Traders Bullish on Polkadot (DOT) Avalanche (AVAX) and Polygon (MATIC) ! HereÉ??s Why?;Coinpedia
TA: Ethereum Plunges Can Buyers Save The Key $3K Support?;NEWSBTC
Google planning to dive in Crypto: Report;Bitcoinik
Crypto Scam Websites Attracted Millions of Indians Last Year Chainalysis Says;News.Bitcoin.com
RT nntaleb: History: in the 70s (even 80s) many closed end funds traded at yuuge discounts making it absurd to not use them i...;Peter David Schiff
RT 3PeaksTrading: Wrote up some thoughts on trading with VWAP and how I read it each day. Hope it helps!NEW POST: How to Use ...;Joe Kunkle
TA: Why Bitcoin Needs To Clear $42500 For Hopes of a Fresh Rally;NEWSBTC
Uranium Q&A with Warren Gilman  Chairman CEO & Director of Queens Road Capital;UraniumSqueeze - Reddit
ChinaÉ??s Central Bank Digital Currency Now Has 261 Million Users  $14 Billion in Digital Yuan Transactions Made;News.Bitcoin.com
HIFO: The Tax Loophole That Could Be Helping Bitcoin Investors This Tax Season;Bitcoinist
European Regulator Calls for Effective Ban on ProofofWork Crypto Mining;Finance Magnates
Liquid Index Series January 2022 Quarterly Review;Brave NewCoin
CoinEx Listing Sees $BABYDOGE Price Jump as Number of Hodlers Keeps Growing;CryptoGlobe
ASX Release 20 January 2022: Boss Energy (ASX: BOE;
Mastercard and Coinbase Partner to Make NFTs More Accessible to Everyone;News.Bitcoin.com
RT quakes99: Today Sprott issued 8000 Physical #Uranium Trust units raising $92K cash but stacked no #U3O8 for NAV of US$...;Bannermann Energy Ltd.
Singapore suspends cryptocurrency ATMs amid broader crypto crackdown;Crypto Daily
3. DKSteuersymposium: Deutsche Kreditwirtschaft diskutiert Herausforderungen der Steuerpolitik;Deutsche Kreditwirtschaft (DK)
European Markets Regulator Urges The EU To Ban ProofofWork Bitcoin Mining;Bitcoinist
SEC to push crypto exchanges into the regulated space in 2022;Cryptopolitan
ETP listings with cryptocurrency as underlyings continues to proliferate;Swiss stock exchange (SIX)
Bergbahn Aktiengesellschaft Kitzb«¨hel muss 17 Klauseln unterlassen;Verbraucherrecht.at
Cryptocurrency Exchange Bybit Launches NFT Marketplace;CryptoPotato
Bitcoin WonÉ??t be Used For Payments Anytime Soon: Paxos CEO;CryptoPotato
21 Shares Lists WorldÉ??s First Cosmos (ATOM) ETP;CryptoPotato
Ethereum The New Hard Money?;NEWSBTC
GEMEINSAMER ENTSCHLIESSUNGSANTRAG zu der Missachtung der Grundfreiheiten in Hongkong  RCB900672022;European Parliament (EP)
GEMEINSAMER ENTSCHLIESSUNGSANTRAG zur Situation in Kasachstan  RCB900652022;European Parliament (EP)
Cardano Dex É??RavendexÉ?ù Launches Exclusive Rave NFT Collection;ZyCrypto
The Canadian Nuclear Safety Commission has approved an amendment to the #uranium mine and mill licence for the McClean Lake Oper...;Denisom Mines Corp
Google exec says company will evolve with user merchant demand for crypto payments;The Block
How US Traders Are Dominating The Bitcoin Market;Bitcoinist
Bitcoin Implied Volatility Plummets To PreBull Market Levels: What This Means;NEWSBTC
Resoluci«¸n de 17 de noviembre de 2021 de la Biblioteca Nacional de Espa«Òa O.A. por la que se publican las cuentas anuales del ejercicio 2019 y el informe de auditor«a.;BOE - Bolet«n Oficial del Estado
Resoluci«¸n de 11 de enero de 2022 del Banco de Espa«Òa por la que se publica la relaci«¸n de participantes directos en TARGET2Banco de Espa«Òa.;BOE - Bolet«n Oficial del Estado
Anuncio de licitaci«¸n de ADIFConsejo de Administraci«¸n. Objeto: Reparaci«¸n y mejora de puentes de hormig«¸n y f«≠brica de la red administrada por ADIF. Lote 1: Zona NoroesteNorte. Lote 2: Zona NoresteEste. Lote 3: Zona CentroSur. Lote 4: Aparatos de apoyoToda la red. Expediente: 4.2128520.0078.;BOE - Bolet«n Oficial del Estado
"Anuncio de la Entidad P«ßblica Empresarial Administrador de Infraestructuras Ferroviarias (ADIF) por el que se comunica la nueva fecha de apertura de ofertas econ«¸micas del procedimiento de contrataci«¸n ""Servicios de representaci«¸n y defensa Jur«dica para la reclamaci«¸n de los da«Òos y perjuicios causados a ADIF AV y a ADIF respecto a las conductas sancionadas por la Resoluci«¸n de 14 de marzo de 2019 dictada por la Comisi«¸n Nacional de los Mercados y la Competencia. (3 Lotes)"". (Expediente: 2.2102110.0174  AV 02921).";BOE - Bolet«n Oficial del Estado
Anuncio de la Facultad de Ciencias Estudios Agroalimentarios e Inform«≠tica de la Universidad La Rioja sobre extrav«o de t«tulo universitario.;BOE - Bolet«n Oficial del Estado
9 Million Ether ($ETH) Worth $28 Billion Has Been Deposited Into Ethereum 2.0 Contract;CryptoGlobe
GEMEINSAMER ENTSCHLIESSUNGSANTRAG zur politischen Krise in Sudan  RCB900682022;European Parliament (EP)
RT Mining_EnergySA: APPLICATIONS CLOSING SOON!  Up to 20 scholarships (valued at $20000 each) are available for students hopi...;Alligator Energy Ltd.
The Many Robust Features Of The Exohood Ecosystem;ZyCrypto
SCRT Labs Launches $400 Million Fund to Bolster Privacy NetworkÉ??s Ecosystem and Application Layer;News.Bitcoin.com
Pantera CIO Believes Ethereum Will Surge 50% In Transactions;Bitcoinist
Looking for trade setups?Here are a few key setups to look out for https:t.coURXzCzCTOQ https:t.colKfhhFg1Jw;Nathan Michaud
Reports Show Government Intends To Imply Stricter Regulations On Cryptocurrency ATMs;NEWSBTC
Daily Thread  January 20 2022;UraniumSqueeze - Reddit
Dvision Network Deploys on Polygon Mainnet as Widespread Interest in Metaverse Continues;News.Bitcoin.com
Google Reportedly Exploring Options To Enable Crypto On Digital Cards;Crypto Daily
Update: IntelÉ??s BitcoinMining Chip É??BonanzaÉ?ù Bags Mining Startup As First Client;Bitcoinist
Cardanobased Stablecoin ADADAO to Hold Public Sale on KICK.IO;ZyCrypto
IndiaÉ??s PM Calls For A Common Global Approach For Tackling Crypto;NEWSBTC
Bank of Americas Quarterly Profit Rises 28%;Wallstreet Journal (WSJ)
Morgan Stanley Profit Rises 9%;Wallstreet Journal (WSJ)
About Trading Derivatives in 2022: How and Where to Do It;ZyCrypto
Gaming Leads the Way into the Metaverse  But Beware the Challenges of Web2.0;ZyCrypto
Bitcoin Flashes UltraBullish Signal Following É??First SelloffÉ?ù Wave In Current Cycle;ZyCrypto
Will This Event Send Cardano To The Bears Again? Or Will Cardano Hop Onto The Bandwagon Led By The Bulls?;Coinpedia
Cardano Is One Potential Altcoin To Count On For Investment This Year;TheNewsCrypto
Google Pay Partners With Cryptocurrency Exchanges To Accept Their Digital Cards;NEWSBTC
Tom BradyÉ??s Autograph NFT Platform Raises $170M From Andreessen Others;Decrypt
Bitcoin Dominance Increases ETHÉ??s Market Share Slides Stablecoin and Smart Contract Coins Rise;News.Bitcoin.com
NFT Marketplace LooksRare Sinks Fangs Into OpenSea With É??Vampire AttackÉ?ù;Bitcoinist
Solana NFT total sales volume crosses $1 billion;The Block
Astar Receives Its First Trusted Oracle Provider: DIA;Coinspeaker
What Happens To Miners After The Last Bitcoin Has Been Mined?  Big Reveal;ZyCrypto
RT Atomicrod: Supplydemand factors are pushing uranium prices higher.Limited investments during past several decades constrai...;enCore Energy Corp
Multicrypto platform MathWallet introduces MathDAO VC fund to accelerate web3 startups;CryptoNinjas
#Gold and #silver mining stocks are having one of their best days in years yet I dont believe CNBC has mentioned them once. Y...;Peter David Schiff
Unilever Walks Away From Glaxo ConsumerHealthcare Deal;Wallstreet Journal (WSJ)
Google Hires PayPal Executive to Expand Crypto Footprint;Decrypt
How Bitcoin Is Controlling The Ebb And Flow Of Crypto;NEWSBTC
Bitcoin Spot Volume Nose Dives To Lowest Since Summer Selloff;Bitcoinist
Intel To Unveil Energyefficient Bitcoin Mining ASIC Chips;Crypto Daily
BloombergAnalyst: Nach Aktieneinbruch um bis zu 20 Prozent kommt Bitcoin st«œrker zur«¨ck;Cointelegraph Germany
Someone keeps adjusting a monster put position in $PACB and has rung the register like a dozen times riding this thing down http...;Joe Kunkle
Ethereum Fees Drop 35% Since Last Week Average ETH Gas Fee Still Above $30 per Transfer;News.Bitcoin.com
Pancake Swap Price Prediction 2022  Will CAKE Hit $30 Soon?;TheNewsCrypto
Blockchain oracle platform API3 set to launch new solution with crypto data provider Amberdata;CryptoNinjas
Massachusetts Police Officer Among 3 Charged With Insider Trading In Kickback Scheme;InsuranceNewsNet
PEJ Launches First Wearable NFTs With Access To The Exclusive Metaverse And RealLife VIP Events;ZyCrypto
Elon Musk Cryptocurrency 2022 Tweet  Is Dogecoin a Good Investment?;InsideBitcoins
spending that $TDOC sale money from a week ago and putting it to work in $GS today. New position $GS LONG 350.00 even.Any i...;Shawn Catena
Umfrage zum Q4 vom Mining Council: BitcoinMining wird nachhaltiger;Cointelegraph Germany
How Bitcoin Could Strengthen From A 10% Correction In The Stock Market;NEWSBTC
TRON (TRX) Annual Statistics Represent an Excellent Track Record;TheNewsCrypto
B.T.E BOTLabs Launches SocialKYC;Crypto News Flash
Stocks over $2B Market Cap Over 200K SharesDay Above 200MAPE > 25 = 201 ;
decent hold here on $NVDA as we take the $252 LONG in front of $250 and take it out on the way back through VWAP a smooth $5.50...;Shawn Catena
#Uranium supply continues to tighten. BHP reports 818 tonnes of #uranium production at Olympic Dam for the second half of 2021 ...;enCore Energy Corp
RT markminervini: As promised I will be releasing a performance audit of my 2021 USIC results conducted by a wellrespected in...;Mike Minervini
Shiba Inu Ether and DOGE Are Slowly Eating Into BitcoinÉ??s MultiBillion Dollar Payments Sphere;ZyCrypto
Microsofts Activision Deal to Power Its NetflixofGaming Aspirations;Wallstreet Journal (WSJ)
Cryptocurrency Debit Cards: One Of The Best Ways to Spend Crypto;UseTheBitcoin
Brazils Center for Electric Energy Research notes the importance of increasing nuclear power generation as changes in rainfall ...;enCore Energy Corp
2022 Market Outlook from Allianz Investment Management LLC. https:t.coFQ7QgDq0lk;Allianz Life
Market prediction dApp PlotX secures $5M in seed funding;CryptoNinjas
Spellfire Oversubscribed Twice a Staggering $3.8M Raised;NEWSBTC
TRX Ranks First Ditching BTC With Highest Active Accounts!;TheNewsCrypto
No one uses #Bitcoin as a medium of exchange. When its up people wont spend it as they dont want to miss out on future gains....;Peter David Schiff
Natalie Timan our Head of Strategy Analysis and Monitoring talks about our strategy and the four outcomes weÉ??re aiming for in...;Payment Systems Regulator (PSR)
Fantom(FTM) Price EyeÉ??s at a New ATH In Next 24 Hours But Will the Market Sentiments Remain Bullish?;Coinpedia
I present the 2022 Uranium Investing Calendar;UraniumSqueeze - Reddit
UFCSchwergewichtsweltmeister will 50 Prozent seines Preisgeldes aus UFC 270 in BTC;Cointelegraph Germany
Kraken Daily Market Report for January 18 2022;Kraken Blog
eToro adds 3 new cryptocurrencies: Fetch.ai Synthetix and Ren Protocol;CoinJournal
SAVAGE signs Paul Nicklen in a deal that shows crypto can be eco-friendly;Bitcoinik
Grayscale Bitcoin Trust Hits Record Discount of 26.53%;Decrypt
Bitcoin Price Trapped Around $42k Glassnode Depicts Collision between Bulls and Bears;Coinspeaker
Bitcoin Cash Price Prediction: BCHUSD Down By 2.77%;InsideBitcoins
Last year people bought #Bitcoin speculating that investors would buy it as a hedge against #inflation. But this year as invest...;Peter David Schiff
CoinEx Lists Baby Doge Coin (BabyDoge) Price Surges 13%;TheNewsCrypto
Grayscale taps Bloomberg for Future of Finance Index launch amid ETF push;The Block
Gravity Bridge now powers crosschain transfers for CosmosEthereum ecosystems;CryptoNinjas
$SPX  a 1015% move off highs would likely open up some opportunitiesA snippet from our 2022 outlook where we closed the yea...;Joe Kunkle
Big Day For Cardano ! What Can ADA HODLERS Expect On January 20th;Coinpedia
Renowned Photographer And Videographer Paul Nicklen Joins É??SAVAGEÉ?? To Highlight The EcoFriendly Possibilities Of NFTs;Crypto Daily
Analysten warnen: Bitcoin k«Ùnnte vor Ausbruch nach oben auf 38.000 USDollar fallen;Cointelegraph Germany
Hacker steals $200000 through Multichain bug offers to return 80% to victim;The Block
BitcoinÉ??s transition to a riskoff asset will propel it to $100K in 2022 says Bloomberg analyst;Cointelegraph
UK Treasury suggests crypto investors may not fully understand what they are buying;Crypto Daily
Crypto Market To Plunge Harder In Coming Days? Bitcoin Price (BTC) to Bottom Out at $38k;Coinpedia
EU Securities Watchdog Urges Regulators To Ban ProofofWork Mining Used By Bitcoin;ZyCrypto
Cryptocurrency Value: Key Factors;NOWPayments
ECB appoints Eva Murciano S«≠nchez as Director General Human Resources;European Central Bank (ECB)
Intel to unveil Bitcoin mining ASIC  how it can solve the energy use challenge;Crypto News Flash
Congrats jessdiggs on being featured on the cover of this monthÉ??s SInow. You make us proud to be your sponsor! https:t.coWu...;Allianz Life
Global Bitcoin mining becoming more sustainable  Mining Council Report;Crypto News Flash
Most Secure SelfCustody Crypto Wallet Provider NGRAVE Raises $6 Million In Seed Funding;Crypto Daily
Top 10 Horizen (ZEN) influencers;NOWPayments
Despite Record Break Burn Why Ethereum Is Facing a Lull In Terms Of Price Action?;Coinpedia
Ertha Token Listing On Kucoin;ZyCrypto
Microsoft Prepares To Build On Metaverse With Activision Acquisition;Crypto Daily
SoFi Bakkt Bank of America Cisco: What to Watch When the Stock Market Opens Today;Wallstreet Journal (WSJ)
Crypto SelfCustody Challenger NGRAVE raises $6M seed round;Crypto News Flash
FOMO mining overnight millionaires: Inside the crypto craze in universities;Crypto News Flash
Hijacking an NFTÉ??s Media  No Coding Required;Kraken Blog
quickly out $SOFI here lets see if we can reload!!!traderTVLIVE https:t.co6D63nI3aag;Shawn Catena
Nexo Taps Bakkt for Crypto Services;Finance Magnates
10 Most Popular Cryptocurrency for 2022 Revealed;InsideBitcoins
Bitcoin Outperforms Nasdaq;TRUSTNODES
Astrology charts and technical analysis: Maren Altman is a star;Cointelegraph
Das Jahr 2021 verursachte Probleme in beispiellosem Ausma«? so das Fazit des #Allianz #Risk #Barometer 2022. Die Kombination von...;Allianz
Bitcoin (BTC) Price Prediction: BTCUSD in a Narrow Range Risks Further Decline below $41k;InsideBitcoins
Cardano ($ADA) Whale: É??Transactions per Second Should Scale to 5001000 This YearÉ??;CryptoGlobe
Ethereum Whale Buys MATIC Worth $17 Million Following EIP1559 Upgrade;DailyCoin.com
ProBit Global Onboards Top Gaming Guild Crypto Gaming United to Strengthen its Global P2E Network;CoinCheckup Blog
Hohes Risiko: Die Lieblingsaktien der Deutschen;Frankfurter Allgemeine Zeitung (FAZ)
IRA Platform iTrustCapital Raises $125M to Expand Bitcoin Retirement Options;Decrypt
Fastgrowing GameFi Startup DEA Raises $12M To Grow Its PlayMining Gaming Metaverse;Crypto Daily
Letter to CEOs;Harvard Law School
The Future of Canada is Crypto As Canadians Favour Crypto Paychecks Over Loonie Survey Reports;ZyCrypto
Law Governing AttorneyClient Privilege for Emails Hosted on Noncompany Servers;Harvard Law School
Crypto Flipsider News  Microsoft Enters the Metaverse Animoca Brands Raises $360 Million Coinbase Partners with Mastercard OpenSea Buys Dharma Labs ETH Whale Buys $17 Million MATIC Intel Mining Chip;DailyCoin.com
Coinbase and Mastercard Are Joining Forces to Make Buying NFTs More Accessible;CoinCheckup Blog
NFT Marketplace OpenSea Acquires Dharma Labs Appoints New CTO;Coinspeaker
Shar Pei The Decentralized Meme Token is Live;CryptoGlobe
~$360M Funding Pushes Animoca Valuation Over $5B;Crypto Daily
Polygon NFTs Are Exploding In Crypto Land;AirdropAlert
State Street Profit Rises on New Business Market Gains;Wallstreet Journal (WSJ)
busy morning already here:SHORT $MS $97.81SHORT $LCID $39.83  cashed some $39.32 LONG $SOFI $13.95lets see what happens...;Shawn Catena
$SBEV  SPLASH BEVERAGE SHARES RISE 47.1% IN PREMARKET TRADE;
Cryptocurrency Payments: Can DeFi Revolutionize This Growing Niche?;NOWPayments
U.S traders account for the lionÉ??s share of Bitcoin trading: Arcane Research;Crypto News Flash
Good Morning Traders PLS RETWEET  #stickynoteShould be a great day today with $LCID lockup and $SOFI getting the bank ch...;Shawn Catena
Singapore Bans Crypto ATMs UK Promises To Clamp Down on Misleading Crypto Ads;CryptoGlobe
$VVOS  VIVOS THERAPEUTICS ANNOUNCES 18X INCREASE IN SLEEP APNEA DIAGNOSTIC TESTING BY VIVOS DENTISTS USING SLEEPIMAGE TECHNOLOG...;Brendan Wickens
CELENFT Debuts CelebrityFocused NFT Platform;ZyCrypto
What is Central Bank Digital Currency (CBDC)?;ZebPay
ATVI Stock Up 25% as Microsoft Announces $69B Acquisition of Activision Blizzard;Coinspeaker
Crypto market suppressed as bond yields climb;Crypto Daily
4Chan Bitcoin Prophecy Coming True;TRUSTNODES
Want to Become a Millionaire with NFT?  Use these Platforms and be Creative!;CryptoTicker
Introducing Quick Trade;ZebPay
A $69B bet on the metaverse? Microsoft buys Activision Blizzard;Crypto News Flash
Why Is Litecoin Sinking? Will LTC Retest $120 Mark?;CryptoNewsZ
Iran Plans to Introduce National Cryptocurrency Soon;Finance Magnates
$BBIG nice unwind after the AHs blow out (likely forced some call sellers to hedge);Nathan Michaud
BitDAO Community Sponsors Chainlink Price Feeds Launch for BIT Token;CryptoNewsZ
$SOFI gets their charter and back to Dec support $13.25 area on 15min looks solid on dip. $LCID hugging 40 slightly up on locku...;Neal Roberts
$MS  Morgan Stanley Q4 EPS Tops Estimates;
Founders of Crypto Exchange BitMEX to Acquire German Bank Formed in 1754;CryptoGlobe
$BKKT  BAKKT HOLDINGS SHARES UP 11.8% PREMARKET AFTER CO SELECTED BY NEXO TO CUSTODY BITCOIN ETHEREUM ;Brendan Wickens
GARI: Powering Bharat ka Super Entertainment;ZebPay
ESMA official suggests banning Bitcoin & Ethereum mining;Bitcoinik
How does Chromia (CHR) work?;ZebPay
Drilling to date at the Dasa #Uranium Project has exceeded expectations. Results will be applied later this year to the Phase 1...;Global Atomic Corp
With Omicron Variant on the Rise FTC Orders More Marketers to Stop Falsely Claiming Their Products Can Effectively Prevent or Treat COVID19;Federal Trade Commission (FTC)
$SOFI  SOFI TECHNOLOGIES SHARES UP 19% PREMARKET AFTER CO GETS REGULATORY APPROVAL TO BECOME A NATIONAL BANK  tradertvshawn;Brendan Wickens
Milo offers to buy house on Bitcoin holdings as collateral;Bitcoinik
Realm and YDragon Join Hands to Expand Metaverse Gaming Capabilities;CryptoNewsZ
EU Regulator Calls for Ban on ProofofWork Mining Used by Bitcoin Ethereum;Decrypt
What Is IOTA?;Crypto Blog by Changelly
A customer found herself stranded in an airport at risk of not saying goodbye to her sick sister. Our team at Allianz Partners ...;Allianz Partners
Microsoft Ramps Up Its Metaverse Plans With $68.7B Acquisition of Activision Blizzard;CoinCheckup Blog
Top DeFi Tokens in Uniswap Chainlink Curve All Dip as Crypto Markets Cool;Decrypt
Mercedes to Launch NFT Collection for Its GClass;CryptoNewsZ
Ava Labs President Says Total Crypto Market Cap Will Go to $5 Trillion in 2022;CryptoGlobe
How to accept salaries in FEG;NOWPayments
Understanding The COSMOS Crypto Project  Investment Worthy in 2022?;CryptoTicker
Animoca Brands Receives $358M Boost the Gaming Firm Goes on Acquisition Rampage;Blockchain News
Chris Hemsley our Managing Director introduces our strategy in his video. He talks about:The key role our strategy will play...;Payment Systems Regulator (PSR)
Solana Ecosystem Latency Made Faster by QuickNode Infrastructure;Crypto Daily
Solana ($SOL) PointofSale;NOWPayments
Singapore crypto ATMs shut down after central bank crackdown;Cointelegraph
Ethereum Classic Fleshes Strength After 2Month Long Correction;CryptoNewsZ
Biden administration unveils plan to combat worsening US wildfires;Reuters
Top places to buy Rainbow Token the hottest new cryptocurrency;CoinJournal
Vielversprechende Anlage: So profitiert die CoinbaseAktie von volatilen KryptoKursanstiegen;Finanzen.net
Statt Apple Alphabet Tesla & Co.: Aktien aus diesen Bereichen sollten Anleger laut UBSStrategen im Blick behalten;Finanzen.net
USDC Surpasses Tether With Over 40 Billion Token Supply on ETH Network;CoinQuora
Top Best NFT Marketplace You Should Look Out For;Coindoo
How does Abracadabra Money (SPELL) work?;ZebPay
Wir putzen regelm«œ«?ig unsere Z«œhne. Warum nicht auch unser Gehirn?;Capgemini
Deutsche Brse und Guangzhou Futures Exchange starten Zusammenarbeit im Emissionshandel;Deutsche B«Ùrse
Theta is up 9% today and counting: hereÉ??s where to buy Theta now;CoinJournal
What is Bitcoin Latinum?;ZebPay
Tokens.com Corp Launches Hulk Labs Focusing on GamFi and NFT;Blockchain News
The costs and benefits of reducing the cyclicality of margin models;Bank Underground
Oil Demand to Exceed PreCovid Levels in 2022 IEA Says;Wallstreet Journal (WSJ)
CardanoÉ??s Incredible Milestones Set ADA For An Explosive Year  HereÉ??s Why;ZyCrypto
FCA confirms approach to European firms temporarily operating in the UK;Financial Conduct Authority (FCA)
FCA to strengthen financial promotions rules to protect consumers;Financial Conduct Authority (FCA)
The role of insurance in creating a sustainable world;PAConsulting
Meine Ausbildung zum Fachinformatiker f«¨r Anwendungsentwicklung;msgGillardon
PlotX Acquires $5 Million in Funding Grant Led By Polygon;TheNewsCrypto
OpenSea Acquires Crypto Wallet Dharma Labs for Undisclosed Amount;Blockchain News
Alpha Data Solutions achieves global ISO 27001 Information Security Certification;InstitutionalAssetManager
Infographic: Finance Trends for Retail and Consumer Packaged Goods;protiviti
