Michael Jordan Multicoin Back Solana NFT Firm Metaplex in $46M Round;Decrypt
Deutsche Brse Market Data + Services erweitert sein AnalyticsAngebot um Eurex Open Interest Insights;Deutsche B«Ùrse
How MELD and Cudos Are Making Mining More Profitable;Crypto Daily
We aim higher. If you do too join us as we care for tomorrow. See employment opportunities at https:t.co9AEOWH3pug and learn...;Allianz Life
PM Modi Calls For Global Uniformity In Crypto Regulations;Crypto Daily
Violent Crime Rising Costs Put South Africas Mining Industry in a Deep Hole;Wallstreet Journal (WSJ)
SplinterlandsÉ??s Successful É?ùChaos Legion PackÉ?ù Sale Booms With Millions of Items Sold;Crypto News Flash
«?NDERUNGSANTR«?GE 485-492 - BERICHT «¨ber den Vorschlag f«¨r eine Verordnung des Europ«œischen Parlaments und des Rates «¨ber einen Binnenmarkt f«¨r digitale Dienste (Gesetz «¨ber digitale Dienste) und zur «?nderung der Richtlinie 2000/31/EG - A9-0356/2021(485-492);European Parliament (EP)
one of my fav. #DayTrading stocks around $PLTRTook these longs and cashed!! traderTVLIVE https:t.co6kyNSqbqxc;Shawn Catena
Crypto.com HACK: Withdrawals Suspended! HereÉ??s what Happened;CryptoTicker
Mars4 Metaverse NFT Sells Like Hotcakes Raised More than $250K in a Day;CoinQuora
Animoca Brands Extends Its Unicorn Status with New $358M Funding;Coinspeaker
How to Buy GALA | Where How and Why;CoinStats Blog
«?NDERUNGSANTR«?GE 516-516 - BERICHT «¨ber den Vorschlag f«¨r eine Verordnung des Europ«œischen Parlaments und des Rates «¨ber einen Binnenmarkt f«¨r digitale Dienste (Gesetz «¨ber digitale Dienste) und zur «?nderung der Richtlinie 2000/31/EG - A9-0356/2021(516-516);European Parliament (EP)
«?NDERUNGSANTR«?GE 509-514 - BERICHT «¨ber den Vorschlag f«¨r eine Verordnung des Europ«œischen Parlaments und des Rates «¨ber einen Binnenmarkt f«¨r digitale Dienste (Gesetz «¨ber digitale Dienste) und zur «?nderung der Richtlinie 2000/31/EG - A9-0356/2021(509-514);European Parliament (EP)
This Bitcoiner Just Lost 26 BTC Worth Over A Million Dollars To A É??Michael Saylor GiveawayÉ?ù Scam;ZyCrypto
Mechanism Capital Launches $100M P2E Gaming Fund Hires Former App Store Manager Steve Cho to Lead It;CoinCheckup Blog
Anime Crypto: Bringing Japanese Culture to the Metaverse;Crypto Daily
QANplatform Officially Launches Quantum Attack Resistant Testnet Rewards Network Developers;CoinQuora
«?NDERUNGSANTR«?GE 458-467 - BERICHT «¨ber den Vorschlag f«¨r eine Verordnung des Europ«œischen Parlaments und des Rates «¨ber einen Binnenmarkt f«¨r digitale Dienste (Gesetz «¨ber digitale Dienste) und zur «?nderung der Richtlinie 2000/31/EG - A9-0356/2021(458-467);European Parliament (EP)
CEOÉ??s Letter on SSGA 2022 Proxy Voting Agenda;Harvard Law School
Blood in the Water: The Value of Antitakeover Provisions During Market Shocks;Harvard Law School
SEC Final Rule Declines to Apply Universal Proxy Card Mandate to Regulated Funds;Harvard Law School
Monetary Authority of Singapore (MAS) bans crypto ads in public areas;InsideBitcoins
FTX CEO Sam BankmanFried on Ethereum Rivals Solana ($SOL) and Avalanche ($AVAX);CryptoGlobe
How to Find Out if a Bitcoin Sports Betting Site Is Trustworthy;Coindoo
What Can You Expect from Bitcoin Ethereum & Cardano Price In the Next 4 to 8 Hours!;Coinpedia
QANplatform launches the worldÉ??s 1st Ethereum Compatible QuantumResistant Blockchain;Bitcoinik
 Will video kill the radio star? Digitalisation and the future of banking;European System Risk Board (ESRB)
ASC publishes report on digitalisation and the future of banking;European System Risk Board (ESRB)
NCFTA onboards crypto exchange Binance to fight against cybercrime;Cointelegraph
Noloss Prize Savings Game INK Protocol Is Off To A Strong Start On The Terra Blockchain;Crypto Daily
QANplatform Showcases Its Quantum AttackResistant Blockchain;Crypto Daily
Shanghai Stocks Rise as China Loosens Bitcoin Unmoved;TRUSTNODES
Start cloud mining today with StakeAdvisor;InsideBitcoins
Ethereum EIP1559 upgrade launches on Polygon mainnet to boost fee visibility;InsideBitcoins
Integral Clients sign off 2021 with ADV up by 17 per cent YoY;InstitutionalAssetManager
Digital transformation being pushed at faster rate by financial services firms says new Broadridge survey;InstitutionalAssetManager
A Guide To Crypto & Casino  What Does the Future Hold?;Coinpedia
Polygon (MATIC) or Cardano (ADA) ? Which Altcoin Can Rally Hard In Coming Days?;Coinpedia
Crypto.com Suspends Withdrawals Due to Unauthorized Activity. Users Claim Losses Up to $15 Million;DailyCoin.com
Aktualisierte Sanktionsmeldung;FINMA
Crypto Flipsider News  Crypto.com Suspends Withdrawals Loses $15 Million BinanceÉ??s Thai Exchange $792 Million in BNB Burnt EIP1559 Live on Polygon Spain and Singapore Crypto Ad Ban Bulgaria and U.K. Top Crypto Holding;DailyCoin.com
"EinKurs f«œllt auf unter 42.000 USDollar: Analyst erwartet immer noch ""einen Impuls nach oben";Cointelegraph Germany
Good Morning Traders PLS RETWEET #stickynoteGood morning new news here with $MSFT and $ATVI notes made before.$AMD s...;Shawn Catena
headline:*Microsoft Nears Deal to Buy Activision Sources Say WSJ $MSFT $ATVII have $MSFT on #stcikynote maybe things hav...;Shawn Catena
Older Women Face Greater Financial Hardship Rockier Road Than Men Do;InsuranceNewsNet
$ATVI  Microsoft Reportedly Nears Deal to Buy Activision Sources Say WSJ;Brendan Wickens
Kevin OÉ??Leary says he could start a Bitcoin mining operation this year;CoinJournal
Cardano foundation partners with EMURGO;Bitcoinik
Kawaii Islands Creates The Worlds First Anime Metaverse;Crypto Daily
Polygon Welcomes London Hardfork Upgrade;Crypto Daily
XRP is Still Bearish: Should You Invest in 2022?;CryptoNewsZ
Gaps down in tech as the 10yr spikes. Big tech in the crosshairs. $LCID lockup expiration tomorrow and 43.50 lower resistance in...;Neal Roberts
Crypto.com reportedly loses $15 million worth of Ethereum (ETH) to hackers;Crypto News Flash
La AEPD y el Alto Comisionado contra la Pobreza Infantil se al«an en el compromiso para cumplir con la Agenda 2030 y los ODS;Agencia Espa«Òola de Protecci«¸n de Datos
Mass payments for freelancers: why is it so good?;NOWPayments
3 Most Promising Blockchains Besides Bitcoin and Ethereum According to SBF;Decrypt
$GS  GOLDMAN SACHS  QTRLY NET REVENUES IN EQUITIES WERE $2.12 BILLION 11% LOWER DUE TO SIGNIFICANTLY LOWER NET REVENUES IN EQ...;Brendan Wickens
UK Treasury wants to remove blockchain reference from crypto definition;Cointelegraph
Publication of financial reports: Federal Office of Justice imposes disciplinary fine on SLEEPZ AG;Bundesanstalt f«¨r Finanzaufsicht (BaFin)
BitMEX confirms acquisition of German bank to launch regulated crypto products in Europe;Crypto News Flash
Financial Services Firms Going Digital At Faster Rate Broadridge Survey Finds;InsuranceNewsNet
$DNAC  PalihapitiyaÉ??s SPAC to Merge With ProKidney in $2.6 Billion Deal;Brendan Wickens
$IO  ION GEOPHYSICAL SHARES UP 49.4% PREMARKET AFTER FORBEARANCE AGREEMENTS SEES HIGHER Q4 REV ;Brendan Wickens
Announcing New Partnership with Unicrypt;CoinStats Blog
Publication of financial reports: Federal Office of Justice imposes disciplinary fine on SLEEPZ AG;Bundesanstalt f«¨r Finanzaufsicht (BaFin)
GameFi Operator Digital Entertainment Asset Closes $12 Million Seed Round;CryptoNewsZ
FTC Returns More Than $10 Million to Consumers Who Paid Hidden Fees to LendingClub;Federal Trade Commission (FTC)
Federal Trade Commission and Justice Department Seek to Strengthen Enforcement Against Illegal Mergers;Federal Trade Commission (FTC)
French fashion house Hermes sues MetaBirkin owner over trademark infringement of Birkin bags;Crypto Daily
Allianz setzt Roboter zur Schadensbearbeitung ein;Versicherungsbote
Security of $BURG Token Gets Compromised. Investors Lose $770K;CryptoNewsZ
UK ranks third globally in terms of number of Ethereum holders: Survey;Crypto News Flash
TON Founder Pavel Durov Endorses Project As It Targets Mass Adoption;Crypto Daily
Binance Removes $729M Worth of BNB From Circulation in FirstEver AutoBurn;CoinCheckup Blog
Crypto.com Suffers Hack for At Least $15M in Ethereum;Decrypt
«?NDERUNGSANTR«?GE 468-473 - BERICHT «¨ber den Vorschlag f«¨r eine Verordnung des Europ«œischen Parlaments und des Rates «¨ber einen Binnenmarkt f«¨r digitale Dienste (Gesetz «¨ber digitale Dienste) und zur «?nderung der Richtlinie 2000/31/EG - A9-0356/2021(468-473);European Parliament (EP)
Texas Arizona Have Recovered All the Jobs Lost When Covid19 Hit;Wallstreet Journal (WSJ)
BahrainBased Crypto Firm Rain Raises $110 Million in Series B Funding;Finance Magnates
Priorities for 2022  the SRBÉ??s view;Single Resolution Board (SRB)
Another midterm worry for Biden White House: probes and impeachment attempts;Reuters
ESMA issues 2021 report on accepted market practices under MAR;European Securities and Markets Authority (ESMA)
Report on the application of accepted market practices_2021;European Securities and Markets Authority (ESMA)
Crypto ATM Market Expected to Hit $1.88B by 2028 with a CAGR of 59.2%;Blockchain News
Transformation study 2022 (zeb);zeb
Pension funds and other institutional investors reduce allocations to fixed income says survey;InstitutionalAssetManager
BitcoinÉ??s price could deflate below $30000 in 2022 Invesco says;CoinJournal
«?NDERUNGSANTR«?GE 007-009 - VORSCHLAG F«?R EINE EMPFEHLUNG DES EUROP«?ISCHEN PARLAMENTS AN DEN RAT UND DIE KOMMISSION nach der Pr«¨fung von behaupteten Verst«Ù«?en gegen das Unionsrecht und Missst«œnden bei dessen Anwendung im Zusammenhang mit dem Schutz von Tieren beim Transport innerhalb und au«?erhalb der Union - B9-0057/2022(007-009);European Parliament (EP)
«?NDERUNGSANTR«?GE 010-011 - VORSCHLAG F«?R EINE EMPFEHLUNG DES EUROP«?ISCHEN PARLAMENTS AN DEN RAT UND DIE KOMMISSION nach der Pr«¨fung von behaupteten Verst«Ù«?en gegen das Unionsrecht und Missst«œnden bei dessen Anwendung im Zusammenhang mit dem Schutz von Tieren beim Transport innerhalb und au«?erhalb der Union - B9-0057/2022(010-011);European Parliament (EP)
CoinAcademy Offers the French Community a Free CryptocurrencyBased Educational Platform;CoinQuora
AMENDMENTS 517-519 - REPORT on the proposal for a regulation of the European Parliament and of the Council on a Single Market For Digital Services (Digital Services Act) and amending Directive 2000/31/EC - A9-0356/2021(517-519)/REV1;European Parliament (EP)
AMENDMENTS 022-030 - PROPOSAL FOR A EUROPEAN PARLIAMENT RECOMMENDATION TO THE COUNCIL AND THE COMMISSION following the investigation of alleged contraventions and maladministration in the application of Union law in relation to the protection of animals during transport within and outside the Union - B9-0057/2022(022-030)/REV1;European Parliament (EP)
AMENDMENTS 520-521 - REPORT on the proposal for a regulation of the European Parliament and of the Council on a Single Market For Digital Services (Digital Services Act) and amending Directive 2000/31/EC - A9-0356/2021(520-521)/REV1;European Parliament (EP)
FemaleBacked VC Blossom Capital Raises $432M to Back Startups;Blockchain News
Market highlights January 18: Cardano continues to rally oil toys with 52week high;CoinJournal
Edge Computing bei CloudAusf«œllen: Plan B f«¨r 5G;IBM
IndiaÉ??s Prime Minister Call for Global Collaboration on Crypto;CoinQuora
Die USNotenbank m«Ùchte eine Straffung der finanziellen Bedingungen herbeif«¨hren ohne dass dies zu Turbulenzen an den M«œrkten f...;Allianz Global Investors
Community policing officer  Requesting backup!;Capgemini
2022 Key Trends in the Public Sector;Capgemini
IAIS Press Release Roadmap 20222023;International Associations of Insurance Supervisors (IAIS)
DeepBlack Historical NFT Project Pays Tribute to BeepleÉ??s $69M Masterpiece;DailyCoin.com
Our Allianz Risk Barometer identifies the most important global business risks for 2022 and beyond. Download the full AGCS_Insu...;Allianz
Build An Effective Finance Strategy;Gartner
How to Organize Finance Department Structure;Gartner
Telos showing strength with impressive gain of 53% in 24 hours: where to buy Telos;CoinJournal
COO Spotlight Series;protiviti
BTFD is more than a meme  itÉ??s a revolution;forkast
The Australian Open launches on the metaverse attracting digital fans;forkast
2021 in Review: How 2021 Proved Out as an Emotional Rollercoaster Year for Crypto Investors;Coindoo
In a Race Towards $3 Will Cardano Outrun Polygon Or Fall Prey To The Bears Again?;Coinpedia
Bitcoin 2022: Was erwartet Krypto-Fans auf der Konferenz in Miami?;CryptoMonday
Kryptob«Ùrse CryptoCom schlie«?t eine Partnerschaft mit der AFL;CryptoMonday
Walmart Preps to Jump into Metaverse NFTs and Crypto;DailyCoin.com
Bitcoin heading for a price crash in 2022 says Invesco Global head;Crypto News Flash
The Bitcoin Bear Cycle is Over! Here Is When The Next BTC Price Breakout!;Coinpedia
Bybit Crypto Exchange Enables Peer-to-Peer Transactions;Coinpedia
What You Should Know About Avalanche Crypto;CryptoTicker
Burnt Finance Raises $3 Million in Funding for NFT Marketplace;CryptoNewsZ
Werkstudent (mwd) Group Taxation;Allianz - Job Postings
Cardano Price To Retest These Levels? End of Rally, or Pause Before The Next Start?;Coinpedia
Throwing Light on Bitcoin Benefits;Coindoo
Cobham  Ultra Electronics merger inquiry;Competition and Markets Authoritiy (CMA)
Crypto Exchange Bitfinex to Stop Serving Ontario Crypto Investors;Blockchain News
KuCoin Announces NFT Airdrop On First Trading Bot Anniversary;Coinpedia
Frequently Asked Questions by the Bitcoin Investors;Coindoo
9th Global Blockchain Congress by Agora Group & TDeFi on February 21st and 22nd in Dubai;CryptoNewsZ
Propy is up 47% in the last 24 hours: hereÉ??s where to buy Propy now;CoinJournal
New Web3 Merchant: Autoworld Integrates Utrust and Prices Cars in EGLD;CryptoNewsZ
Bictory Finance is the first Concordium Grantee, Tackling Reg-Defi and NFTs!;Coinspeaker
Thailand Government Disperses Confusion Surrounding Cryptocurrency Taxation;NEWSBTC
Modi Urges Global Effort to Deal with Crypto Indian Crypto Sector Remains in Uncertainty;Blockchain News
Cryptocurrency Market Cap Increased by 13% in Q4 2021;Finance Magnates
Crypto.com Reportedly Lost $15 Million in a Cyberattack;Finance Magnates
ETH 2.0 Contract Surpasses 9 Million Ethereum Worth $28 Billion;News.Bitcoin.com
nCore Games Raises $10M in Funding Ready for New Web3.0 Offerings;Blockchain News
Metaverse Avenue The Solana Based Marketing Platform Set To Transform A Billion Dollar Industry;NEWSBTC
Lucrosus Capital Launched $LUCA  Decentralized Venture Capital (DeVC);News.Bitcoin.com
Crypto Investment Products See a Drop in Weekly Outflows;Finance Magnates
Verwahrentgelt  Vom Sorgenkind zum Erfolgscase;Versicherungsbote
Bitcoin(BTC) Price and Ethereum (ETH) Price Can Surge More Than 300% in 2022, Says Analyst;Coinpedia
Cardano (ADA) founder says it is just getting started ADA surged 38%;Bitcoinik
Blossom Capital targets crypto tokens with new $432 million fund;The Block
CFPB Bans BrightSpeed Solutions and Its Former CEO for Supporting Telemarketing Scammers Targeting Older Americans;Consumer Financial Protection Bureau
Pakistani Bank Asks Customers to Avoid Conducting Crypto Transactions;News.Bitcoin.com
Indian PM urges all countries to shape cryptocurrency regulations jointly;Bitcoinik
∆?Ω∆ü¶∆üü∆?Ó∆?˚∆ü?∆ü¨∆ü?∆ü?∆ü¨∆?ßÜ?´Ç??ÑØ˝äúÅ∆?œ∆ü¸∆?Ê∆?œ∆ü?∆?˙∆ü¶∆ü¨∆?ß á™™1Ü?? M&AáÔ?Ñß?∆ÅÆ∆Å?∆Å?∆??ëêçÜ©¸á©?Ü©?;AlixPartners
Singapore Bars Crypto Service Providers for Public Ads;Blockchain News
Coin Healthcheck: Near Protocol (NEAR);DailyCoin.com
Larry FinkÉ??s Letter to CEOs Says Stakeholder Capitalism Is Not É??WokeÉ??;New York Times (NYT)
Crypto.com Signs $18m Sponsorship Deal With Australian Football League;Crypto Daily
HolyShxxt!s NFT and Future GameFi plans Shows HKs Potential;Blockchain News
Binance eyes Thailand for latest crypto exchange expansion;Cointelegraph
Binance Lands Sponsorship Deal with BrazilÉ??s Soccer League Paulist«úo Sicredi;Finance Magnates
TA: Bitcoin Key Indicators Suggest A Strengthening Case For Move Below $40K;NEWSBTC
Green Energy: In NY Bitcoin Mining Saved The Oldest Working Hydroelectric Plant;NEWSBTC
IndiaÉ??s Prime Minister Modi Calls for Global Collaboration on Crypto  Says É??We Have to Have a Similar MindsetÉ??;News.Bitcoin.com
RT quakes99: Today was Selection Day for Solactive Index tracked by Global X #Uranium#Nuclear ETF $URA. If #SPUT was added as ...;Bannermann Energy Ltd.
 https:t.coRZ5crmpGUT;Nathan Michaud
#Bitcoin has failed to live up to the hype and those institutions that put a toe in the water last year are not likely to take t...;Peter David Schiff
RT CaraRLombardo: .wsj scoop: Activist investor Macellum is renewing a push to get departmentstore chain KohlÉ??s to take actio...;Joe Kunkle
RT InvestorsLive:  FREE SCAN + VIDEO  Check out my stock watch list and detailed game plan for tomorrow https:t.colNglC...;Nathan Michaud
Cardano: Prominent Crypto Analyst Explains How to Trade $ADA as It Surges;CryptoGlobe
The AustraliaChina trade dispute: what happened and whatÉ??s next?;Freshfields Bruckhaus Deringer
Singapore Restricts Crypto Ads  Central Bank Says Crypto Trading Not Suitable for the General Public;News.Bitcoin.com
$1.7M cash raised from the issuing of 147.5K Sprott Physical #Uranium Trust units. $BMN $BNNLF https:t.coYZKgG729YV;Bannermann Energy Ltd.
4600 ETH Worth $14.6M Reportedly Stolen From CryptoCom Money Laundered via TornadoCash;CryptoPotato
Over 1.6M BNB Removed In BinanceÉ??s First Quarterly AutoBurn;CryptoPotato
Pool Re backs new research consortium tackling systemic risks;Insurance Business UK
Allianz Risk Barometer 2022;Allianz
Governance and Success in US SecuritiesBased Crowdfunding;Oxford Business Law School
Zahlreiche Klauseln von EScooterVerleiher Bird unzul«œssig;Verbraucherrecht.at
Freshfields Fintech: predictions for 2022  #2 Fintech Regulation;Freshfields Bruckhaus Deringer
Summary report  É??Targeted consultation on taking stock of the framework for supervising European capital markets banks insure...;Norton Rose Fulbright
ECB opinion on a proposal to amend the CRR with respect to resolution;Norton Rose Fulbright
IOSCO consults on measures to address risks arising from digitalisation of retail marketing and distribution;Norton Rose Fulbright
Summary of changes to the BoEÉ??s ISO 20022 migration announced;Norton Rose Fulbright
Payment fraud data trends;Norton Rose Fulbright
EBA confirms the continued application of COVID19 related reporting and disclosure requirements until further notice;Norton Rose Fulbright
Monthly Global FinTech regulatory updater;Norton Rose Fulbright
Treasury International Capital Data for November;U.S. Department of the Treasury
Developing Contractual Standards for Crypto Derivatives;International Swaps and Derivatives Association (ISDA)
VC Firm Blossom Capital Raises $432M to Invest in the Cryptocurrency Ecosystem;CryptoPotato
The Cardano Foundation Partners with EMURGO to Develop New dApps;CryptoPotato
Intel Plans Bitcoin Mining Chip Reveal At Upcoming Conference;CryptoPotato
Bukele DoesnÉ??t Care About El SalvadorÉ??s Downgraded Sovereign Debt;CryptoPotato
Animoca BrandsÉ?? Valuation Surges to $5.5 Billion With Fresh $360 Million Funding;CryptoPotato
SolanaBased Hubble Protocol Raises $10M Ahead of Mainnet Launch;CryptoPotato
Bitcoin Is Here to Stay: JPMorgan Exec;CryptoPotato
The AXL DEX: Making DeFi Comfortable;CryptoPotato
Blockchainbased insurance set to transform claims administration;Insurance Business UK
UK FCA to regulate misleading crypto ads;Cryptopolitan
The gas fees by the time I collected rewards unstaked $LOOKS and swapped to ETH looks like a CVS receipt;Joe Kunkle
Top 10 Most Popular Cryptocurrencies in 2022 So Far;CoinJournal
RollsRoyce Bentley BMW Sales Surge as Cheaper Brands Lag Behind;Wallstreet Journal (WSJ)
Altcoins Are Encroaching On BitcoinÉ??s Dominance On Digital Payments;NEWSBTC
Deep Yellow drill results from Barking Gecko North  follow up drilling to start on Jan 24th;UraniumSqueeze - Reddit
«?nderungen des Protokolls von 1998 zu dem «?bereinkommen von 1979 «¨ber weitr«œumige grenz«¨berschreitende Luftverunreinigung betreffend persistente organische Schadstoffe;Rechtsinformationssystem des Bundes (RIS)
Anuncio de formalizaci«¸n de contratos de: Direcci«¸n de la Agencia Espa«Òola de Protecci«¸n de la Salud en el Deporte. Objeto: Adquisici«¸n de materiales de repuesto y fungibles para el mantenimiento interno y an«≠lisis con los instrumentos anal«ticos marca AGILENT TECHNOLOGIES para el Laboratorio de Control del Dopaje de la AEPSAD. Expediente: 202100000134.;BOE - Bolet«n Oficial del Estado
Higher education: making EU's universities ready for the future through deeper transnational cooperation;European Commission (EC)
REACTEU: É?™136 million to support six Polish regions in the fight against the coronavirus pandemic and to support their digital and green transition;European Commission (EC)
The best Ethereum Layer 2 scaling solutions to buy right now;CoinJournal
Cardano ($ADA) Sees Transaction Volume Briefly Surpass That of Ethereum ($ETH) Ahead of DEX Launch;CryptoGlobe
 FREE SCAN + VIDEO  Check out my stock watch list and detailed game plan for tomorrow https:t.colNglCrK2rT$BBIG $DWAC ...;Nathan Michaud
25% of US Adults Plan to Start Investing in Crypto Survey Shows;News.Bitcoin.com
Bitcoin is Forming Insane Patterns. What is Waiting for BTC Price in the Next Couple of Days?;Coinpedia
Law Decoded: Firstmover advantage in a CBDC conversation Jan. 1017;Cointelegraph
$NCLR provides 2021 recap;UraniumSqueeze - Reddit
ADALend: A New Perspective On Native Cardano DeFi From the Eyes of ADALendÉ??s CEO;News.Bitcoin.com
Cardano Hits Bottom? What You Should Consider Before Rushing Into ADA;NEWSBTC
Daily Thread  January 18 2022;UraniumSqueeze - Reddit
Three Principles for Understanding Cryptocurrency;UseTheBitcoin
Fidelity Says What WeÉ??ve Been Thinking: Countries & Central Banks Will Buy BTC;NEWSBTC
Blockchain Courts and Cats That Look Like Dogs: How DAOs Wrestle With the Law;Decrypt
Bitcoin Price Prediction: BTCUSD Finally Drops Below $42000;InsideBitcoins
Elliptic is developing a new blockchain data product for institutional crypto traders;The Block
BBC Funding Frozen for 2 Years as Cabinet Minister Attacks Public Fee;New York Times (NYT)
Max Keiser: Bitcoin Will Reach $220K by End of 2022;CryptoGlobe
Litecoin Price Prediction: LTCUSD Grows 2.42% as Price Nears $155 Level;InsideBitcoins
15 Privacy Coins See DoubleDigit Weekly Gains Monero Jumps 13% Secret Gains 50%;News.Bitcoin.com
"Bitcoin weiter in enger Spanne: Analysten erwarten ""interessante Woche"" f«¨r BTC";Cointelegraph Germany
Crypto Influencers Face $300K Fines in Spains Advertising Crackdown;Decrypt
OpenSea Achieves New ATH of $3.5 Billion in ETH!;TheNewsCrypto
"Crypto.com setzt Auszahlungen wegen ""verd«œchtiger Aktivit«œten"" aus";Cointelegraph Germany
BERICHT «¨ber die vorgeschlagene Ernennung von Jan Gregor zum Mitglied des Rechnungshofs  A900022022;European Parliament (EP)
BERICHT «¨ber die vorgeschlagene Ernennung von Mihails Kozlovs zum Mitglied des Rechnungshofs  A900032022;European Parliament (EP)
METABLAZE Announce Upcoming Presale Offering of Its Unique BSCbased Utility Token;ZyCrypto
CardanoÉ??s Hoskinson Claims Gargantuan Billions In ADA Inflows Are É??Just Getting StartedÉ??  And HereÉ??s Why;ZyCrypto
BERICHT «¨ber die vorgeschlagene Ernennung von Jorg Kristijan Petroviéç zum Mitglied des Rechnungshofs  A900052022;European Parliament (EP)
Dogecoin Billy Markus Thrashes Crypto.com for Hacks!;TheNewsCrypto
BERICHT «¨ber die vorgeschlagene Ernennung von Marek Opioè?a zum Mitglied des Rechnungshofs  A900042022;European Parliament (EP)
Bitcoin Supply Shock: Only 12% Of BTC Supply Is On Exchanges Now;NEWSBTC
«?NDERUNGSANTR«?GE 156-156 - BERICHT «¨ber einen Vorschlag f«¨r eine Verordnung des Europ«œischen Parlaments und des Rates zu einer verst«œrkten Rolle der Europ«œischen Arzneimittel-Agentur bei der Krisenvorsorge und dem Krisenmanagement in Bezug auf Arzneimittel und Medizinprodukte - A9-0216/2021(156-156);European Parliament (EP)
Helium Price Prediction 2022  Will HNT Hit $60 Soon?;TheNewsCrypto
Cardano IDO LaunchPad É??CoollaunchÉ?ù Records a Buzzing Progress as It Sells Out Over 11% Of $COOL Tokens Within Days;Coinspeaker
Bitcoin Ethereum Monero Hashrates Tap Lifetime Highs  Dash ETC LTC Hashpower Lower Than Prior ATHs;News.Bitcoin.com
OHM Holders Wake Up To Blood How This OlympusDAO Whale Sank Its Price by 44%;NEWSBTC
The 5 Promising Blockchain Projects Leading The Way Forward For Decentralized Technology In 2022;NEWSBTC
«?NDERUNGSANTR«?GE 532-541 - BERICHT «¨ber den Vorschlag f«¨r eine Verordnung des Europ«œischen Parlaments und des Rates «¨ber einen Binnenmarkt f«¨r digitale Dienste (Gesetz «¨ber digitale Dienste) und zur «?nderung der Richtlinie 2000/31/EG - A9-0356/2021(532-541);European Parliament (EP)
Metaverse Avenue É?? WorldÉ??s First NFT Based Advertising Metaverse;Coinpedia
PlaceWar CoFounder Myrtle Anne Ramos Talks Gamified Internet Culture Metaverse and PlaytoEarn;News.Bitcoin.com
Crypto.com ($CRO) Partners With Australian Football League to Reach Millions of Australians;CryptoGlobe
