Infographic: Finance Trends for Retail and Consumer Packaged Goods;protiviti
Fusang receives green light for US$10M equitytoken IPO;forkast
Polygon upgrade ignites token burn to make MATIC more valuable;forkast
Binance Becomes the Blockchain and Cryptocurrency IndustryÉ??s First to Join the National CyberForensics and Training Alliance (NCFTA);DailyCoin.com
Altcoins Like XMR AXS BNB Primed For A VShaped Rebound A 5X Surge In The Pipeline?;Coinpedia
Kontinuit«œt an der F«¨hrungsspitze: Der Wieslocher #Finanzdienstleister MLP_SE hat den Vertrag mit Vorstandschef Uwe Schroeder...;Versicherungswirtschaft Heute
Der Versicherungsmanager https:t.cojLrMj3fAO3 kooperiert derzeit mit 21 #Volksbank|en und #PSDBanken. Nach Informationen von...;Versicherungswirtschaft Heute
Bitcoin Kurs-Prognose: Fear & Greed Index zeigt extreme Angst;CryptoMonday
Cardano Kurs-Prognose: Warum ADA in den letzten Tagen gestiegen ist;CryptoMonday
These Catalysts May Propel BTC Price Upto $70k By Mid2022 This May Be É??InvestorsFavoriteÉ?ù BuyZone?;Coinpedia
UFC Heavyweight Champ Announces Cash App Partnership;
MSCI partners with Menai Financial Group;InstitutionalAssetManager
Morrison & Co appoints Board Director;InstitutionalAssetManager
LiquidityBook appoints Head of Global BuySide Sales;InstitutionalAssetManager
ICONÉ??s BTP Interoperability Ecosystem To Integrate Algorand;TheNewsCrypto
New York LifeÉ??s impact investment initiative commits USD50m in longterm capital to Century Housing Corporation;InstitutionalAssetManager
InvestorPortaLPro launches two new investor portal software solutions;InstitutionalAssetManager
ElektroInnovationen: Laden ohne Kabelsalat: EnBW und Wien Energie investieren in neue Technologie;Handelsblatt
Sachbearbeiter (mwd) f«¨r die Abteilung FB Tierkrankenversi...;Allianz - Job Postings
UK Regulator Cracks the Whip on Deceptive Cryptocurrency Ads;Blockchain News
Jack Dorsey Backed Cash App Integrates Bitcoin Lightning Network;TheNewsCrypto
Neues Gesch«œftsfeld: Deutsche Telekom steigt in den Markt mit CloudTelefonie ein;Handelsblatt
Blocks Cash App to Allow Free Bitcoin Transactions With Lightning Network;Blockchain News
MANA Price Prediction  Potential MANA Token BOOM of 175% soon?;CryptoTicker
Covid19 Claims a Big CruiseLine Victim;Wallstreet Journal (WSJ)
Privacy Preservation in The Blockchain Space  An Enlightening Panel Discussion;Crypto News Flash
ShibaInfinity Dog Metaverse Hits its Hard Cap in First Private Token Sale raising 500 Solana;TheNewsCrypto
Heroes of NFT Unveils its First Collectible NFT Card Game on Avalanche;TheNewsCrypto
Blockchain Fest 2022: Crypto CommunityÉ??s Yearly Event Returns;CryptoNewsZ
Financial Market Committee Chair Aksakov Joins Calls for Identification of Russian Crypto Owners;News.Bitcoin.com
Elrond Acquires Leading Crypto Payments Startup Utrust;TheNewsCrypto
Elon Musk says believe in the future is it dogecoin?;Bitcoinik
Invictus NFT Lab Blazes Trail for a New Fine Art Paradigm;News.Bitcoin.com
Bitcoin mining becomes more sustainable: Mining Councils Q4 survey;Cointelegraph
WhistleblowingRichtlinieÉ?ù: Ich wei«? was was Du nicht wei«?t;Versicherungsbote
HereÉ??s Why ADA BNB AVAX & SOL Price Are Not In Bearish Market !;Coinpedia
Fantom Price Forecast :OnChain signals bullish for FTM Price;Coinpedia
Ethereum ($ETH) Is Losing NFT Market Share to Solana ($SOL) JPMorgan Analysts Say;CryptoGlobe
MetaFans: The Future of Sports Fandoms with NFTs;NEWSBTC
Coinbases NFT Platform to Allow Purchase With Credit & Debit Cards;Blockchain News
Auditing Firms Claim Crypto.com Lost $15 Million in Incident as Users Report Suspicious Activity;News.Bitcoin.com
KOMMENTAR  Smart Valor: Eine KryptoB«Ùrse zieht nordw«œrts;Neue Z«¨richer Zeitung (NZZ)
Chinas eCNY is Growing despite Local Payment Options Lack behind;Blockchain News
RT quakes99: During last #Uranium bull market investment in exploration topped a $Billion in a single year in 2008 with global ...;Bannermann Energy Ltd.
Why Hubble Protocol Is The Hottest IDO On The Market This January;NEWSBTC
Cardano ($ADA): New Project to É??Accelerate Decentralized Application DevelopmentÉ?? Launched;CryptoGlobe
TA: Bitcoin Reaches Key Juncture Why Recovery WonÉ??t Be Easy;NEWSBTC
Microsoft to Buy Activision Blizzard for Nearly $70 Billion;New York Times (NYT)
Cyber ist TopRisiko in der Schweiz;investrends
Cybersecurity: Mit Psychologie gegen Hacker: Sosafe setzt auf spielerische Sicherheit;Handelsblatt
OpenSea Acquires Dharma Labs;Crypto Daily
SkyHigh Transaction Fees are Driving NFT Users Away from Ethereum says JPMorgan;Blockchain News
Britney Spears Fights FatherÉ??s Fee Claim Alleging Financial Misconduct;New York Times (NYT)
Will PlaytoEarn Projects Be The Ideal Investments for 5X Returns In The Bear Runs ?;Coinpedia
UK to Tighten Rules on Crypto Ads to Ensure TheyÉ??re Fair Clear Not Misleading;News.Bitcoin.com
RT quakes99: Today Sprott issued 129.1K Physical #Uranium Trust units that raised $1.5M cash  but no #U3O8 stacked for ATH...;Bannermann Energy Ltd.
Georgian citizens made to swear an oath to stop mining crypto;Cointelegraph
Coinbase Partners with Mastercard to Revolutionize NFT Purchase Experience;Finance Magnates
Bitcoin Leverage Flush Looms as 30% of Supply Underwater: Report;Decrypt
Robinhood to Wait for Regulatory Clarity Before Listing Shiba Inu ($SHIB) and Other Cryptos CFO Says;CryptoGlobe
Microsofts Activision Deal May Bring Metaverse to Enterprise Tech;Wallstreet Journal (WSJ)
Despite spiking nominal bond yields the price of #silver jumped about fifty cents an ounce today. Thats a big move on a down da...;Peter David Schiff
What to expect from US enforcement agencies in 2022;Freshfields Bruckhaus Deringer
WorkLife 2.0: Austria becomes the first EU country to impose COVID19 vaccines to all its adult population  what does this mean...;Freshfields Bruckhaus Deringer
As promised I will be releasing a performance audit of my 2021 USIC results conducted by a wellrespected independent accountin...;Mike Minervini
Binance to Launch New Cryptocurrency Exchange in Thailand After Thai SEC Filed Criminal Complaint;News.Bitcoin.com
We are pleased to announce the results of the resource definition drilling program recently completed at the Koppies project in ...;Elevate Uranium Ltd.
Ethereum NFT Badge App POAP Raises $10M to Fund Development;Decrypt
Financial Services Academy: Focusing on financial promotions;Norton Rose Fulbright
Letter to Danish Financial Supervisory Authority regarding Interpretation of the Payment Accounts Directive and Negative interes...;Norton Rose Fulbright
FCA CP222: Strengthening our financial promotion rules for high risk investments including cryptoassets;Norton Rose Fulbright
Summary of FERC Meeting Agenda for January 2022;White & Case
Crypto friendly Singapore clampdown on crypto ATM services;Cryptopolitan
Controlling Tunnelling Through Lending Arrangements;Oxford Business Law School
Singaporean GameFi Firm Raises $12M During Seed Funding Round;CoinQuora
Toko Token (TKO) Releases Whitepaper at Kripto Odyssey Summit 2021;CryptoPotato
Silvergate CapitalÉ??s Q4 Earnings Showcase Growth in Cryptocurrency Engagement;CryptoPotato
OpenSea Acquires Dharma Labs to Explore Fiat for NFTs;CryptoPotato
SURVEY: 13th Annual Cost of Compliance Survey;Reuters
Priorities for 2022  the SRBÉ??s view;Norton Rose Fulbright
CosmosBased Privacy Startup Nym Onboards Network Validators;CryptoPotato
MoroccoÉ??s Biggest Bank to Dive in Crypto by Joining RippleNet (Report);CryptoPotato
Crypto Could Contribute to BNY MellonÉ??s Revenue in 2023 Says CEO;CryptoPotato
Iranian CBI Officials Reveal CBDC Pilot Phase to Start Soon;CryptoPotato
ThirdLargest Ethereum Whale Just Spent $14 Million on These 3 Altcoins;CryptoPotato
Sirma Boshnakova l«œsst Worten Taten folgen;Allianz
Government to strengthen rules on misleading cryptocurrency adverts;Norton Rose Fulbright
The Waste and Agriculture (Legislative Functions) Regulations 2022;United Kingdom Statutory Instrument
Neue Folge Politik am Ring: Teure Wohntr«œume  Wie garantieren wir leistbares Wohnen?;Austrian Parliament
Why buy #Bitcoin in the market when you can buy all the Bitcoin you want through $GBTC for 73 cents on the dollar? If institutio...;Peter David Schiff
Spot #uranium continues to hold closing at US$45.75lb. Carnage in the equity and bond markets today appears to reflect anticip...;enCore Energy Corp
A.V. Club staff members lose their jobs after refusing a move to Los Angeles.;New York Times (NYT)
DogecoinFriendly AMC Rewards 580K Shareholders With Free NFTs;Decrypt
Bitcoin Millionaires Are Flocking To This North American Tax Haven. But What Do The Locals Think?;NEWSBTC
EU Cohesion policy: Almost É?™385.5 million from the EU Solidarity Fund to 19 countries to tackle the coronavirus health emergency;European Commission (EC)
Real Decreto 542022 de 18 de enero por el que se promueve al empleo de Teniente General del Cuerpo General del Ej«∏rcito de Tierra al General de Divisi«¸n don Alejandro Gonzalo Esc«≠mez Fern«≠ndez.;BOE - Bolet«n Oficial del Estado
Real Decreto 552022 de 18 de enero por el que se promueve al empleo de General de Divisi«¸n del Cuerpo General del Ej«∏rcito de Tierra al General de Brigada don Antonio Jes«ßs Cabrerizo Calatrava.;BOE - Bolet«n Oficial del Estado
Real Decreto 562022 de 18 de enero por el que se promueve al empleo de General de Brigada del Cuerpo General del Ej«∏rcito de Tierra al Coronel don Carlos Mar«a Castrillo LarretaAzela«n.;BOE - Bolet«n Oficial del Estado
Anuncio de licitaci«¸n de la Direcci«¸n General del Servicio P«ßblico de Empleo Estatal. Objeto: Suministro de equipos audiovisuales para el auditorio del centro de formaci«¸n Santamarca del servicio p«ßblico de empleo estatal (COE) asociado al plan de recuperaci«¸n transformaci«¸n y resiliencia de la econom«a espa«Òola. Expediente: PA 922.;BOE - Bolet«n Oficial del Estado
Resoluci«¸n de la Direcci«¸n General de Trabajo por la que se anuncia el dep«¸sito de la modificaci«¸n de los estatutos de la asociaci«¸n empresarial denominada ASOCIACI«?N DE EMPRESAS DE MARKETING OPERACIONAL en siglas AEMAR con n«ßmero de dep«¸sito 99000078 (antiguo n«ßmero de dep«¸sito 6382).;BOE - Bolet«n Oficial del Estado
FIGUEROA SOCIEDAD AGRARIA DE TRANSFORMACI«?N (S.A.T.) N∂ß SE0031.;BOE - Bolet«n Oficial del Estado
Verordnung zur Gew«œhrleistung der ITSicherheit der im Portalverbund und zur Anbindung an den Portalverbund genutzten ITKomponenten (ITSicherheitsverordnung Portalverbund  ITSiVPV);Bundesanzeiger
Anordnung zur «?bertragung beamtenrechtlicher Zust«œndigkeiten der Beauftragten der Bundesregierung f«¨r Kultur und Medien (BKMZust«œndigkeitsanordnung  BKMZustAnO);Bundesanzeiger
Verordnung des Bundesministers f«¨r Soziales Gesundheit Pflege und Konsumentenschutz mit der die Verordnung betreffend die Erhebung von Kontaktdaten durch Bef«Ùrderungsunternehmer ge«œndert wird;Rechtsinformationssystem des Bundes (RIS)
Verordnung des Bundesministers f«¨r Soziales Gesundheit Pflege und Konsumentenschutz mit der die COVID19Einreiseverordnung 2021 ge«œndert wird (12. Novelle zur COVID19Einreiseverordnung 2021);Rechtsinformationssystem des Bundes (RIS)
Verordnung des Vorstandsvorsitzenden der Telekom Austria Aktiengesellschaft «¨ber die Anpassung der Bez«¨ge und Zulagen f«¨r die gem«œ«? ∂ı 17 Abs. 1a Poststrukturgesetz (PTSG) der Telekom Austria Aktiengesellschaft zur Dienstleistung zugewiesenen Beamtinnen und Beamten (TelekomBez«¨geverordnung 2022);Rechtsinformationssystem des Bundes (RIS)
Information for New Issuers;Bundesanstalt f«¨r Finanzaufsicht (BaFin)
Most JPMorgan Clients See Bitcoin ($BTC) Surpass $60000 This Year;CryptoGlobe
Microsoft to Buy Activision Blizzard;Wallstreet Journal (WSJ)
RT quakes99: Spot #Uranium continues to hover around its 2022 high with US #Nuclear fuel brokers EvoMarkets closing at US$45....;Bannermann Energy Ltd.
Dont just analyze a trade from YOUR OWN perspective. Think about how the rest of the market may view an opportunity https:t.c...;Nathan Michaud
Trotz Missbrauchsvorw«¨rfen: Microsoft will einen Spieleanbieter kaufen und weiter ins Metaversum vorstossen;Neue Z«¨richer Zeitung (NZZ)
Heavyweight Champ Francis Ngannou Plans to É??Take Half of His UFC 270 Purse Paid in BitcoinÉ??;News.Bitcoin.com
MANY WORLDS The WorldÉ??s First Dynamic Tokenomics Dominates Market with Record Breaking 1260 BNB Presale Followed by Surging Growth on DEX;Crypto Daily
SplinterlandsÉ?? Successful É?ùChaos Legion PackÉ?ù Sale Booms with Millions of Items Sold;Coinspeaker
Polygon (MATIC) Is All Set To Double Its Price! Why Is 100% Upswing Is Inevitable?;Coinpedia
Daily Thread  January 19 2022;UraniumSqueeze - Reddit
Win up to 3000 USDT at LBank ExchangeÉ??s 100% Winning Event!;News.Bitcoin.com
OCC Conditionally Approves SoFi Bank National Association;Office of the Comptroller of the Currency (OCC)
$LOOKS only thing breaking out these days ha https:t.combAxxiWNhn;Joe Kunkle
Ethereum Price Prediction: ETHUSD Approaches $3000 Support;InsideBitcoins
Panteras new venture fund sees $1 billion in total commitments;The Block
Terra BlockchainBased INK Protocol Keeps Achieving Milestones With Its No Loss Savings Game;ZyCrypto
Goldman Sachs Profit Falls 13% as It Raises Bankers Pay;New York Times (NYT)
Bitcoin Price Prediction: BTCUSD Establishes A Low At $41287;InsideBitcoins
UFC Champ Francis Ngannou Teams With Cash App to Take Winnings in Bitcoin;Decrypt
5 Reasons Why You Should Buy Polygon;CoinJournal
Bitstamp Becomes Official Sponsor of Guild Esports Team;Finance Magnates
Ravendex On A Mission To Become The First AMM Powered DEX On Cardano;Coinspeaker
$QQQ getting near 1st target a nice weak open tomorrow could set up for bulls to take a stand... https:t.couyyOgE2diK;Joe Kunkle
MicrosoftActivision Deal Likely to Face Close Antitrust Scrutiny;Wallstreet Journal (WSJ)
Unused Bandwidth Monetization Protocol PKT Cash Lands Bittrex Listing;ZyCrypto
Blockchain Firm Animoca Brands Raises $358 Million to Enhance Web3 and the Metaverse;News.Bitcoin.com
BitMEX EARN adds support for bitcoin (BTC) with up to 6% APR;CryptoNinjas
NFT Gaming Investor Animoca Brands Valued Above $5B After $359M Raise;Decrypt
AutoSwap Integration Brings Limit Orders and Stop Losses To Trader Joe and Avalanche;ZyCrypto
Full disclosure I took this video with $BBIG longs in mind but turns out its $DWAC shorts instead  https:t.coLKUktYd1vN;Nathan Michaud
WhatÉ??s All the Hype About the Metaverse?;New York Times (NYT)
How Metaverse Miner the First InterstellarTheme Game Play to Earn;Crypto Daily
ARKK is down another 3.5% today hitting a new 52week low. CathieDWoods flagship fund is now down almost 52%. The only thing ...;Peter David Schiff
Still LONG $DWAC!!! LFG!!  https:t.co9ROirwcVz2;Shawn Catena
Downward DOGE: Descending Dogecoin Pattern Predicts Deadly Drop;NEWSBTC
Jack Dorsey and Marc Andreessens Crypto Feud Puts Web3 at Risk;New York Times (NYT)
Basin Uranium Corp. ($NCLR.C $BURCF) engages TerraLogic for proposed exploration and development work program on the Mann Lake u...;UraniumSqueeze - Reddit
Cardashift Is Building a CardanoPowered Launchpad For Sustainable Impact;Decrypt
Why Are Bitcoin Millionaires Moving to Puerto Rico?;DailyCoin.com
70% Of Bitcoin Supply Is In Profit  Why Bulls Need To Defend This Level;NEWSBTC
The Grayscale Bitcoin Trust is now at a record 27% discount to NAV. CNBC viewers who got suckered into buying $GBTC based on a ...;Peter David Schiff
The NFT InvestorÉ??s Worst Nightmare: IRS Craves For A Crackdown;NEWSBTC
Coinbase Partners With Mastercard For Its Upcoming NFT Platform;Crypto Daily
The School of Bitcoin  Teaching the next generation;Brave NewCoin
Intel Plans to Launch BitcoinMining É??Bonanza MineÉ?? Chip;Finance Magnates
Intel To Present Low Voltage Energy Efficient Bitcoin Mining Chip At Conference;NEWSBTC
If you thought you were safe in Big Banks... $JPM $GS $MS had another idea;Joe Kunkle
NFT Marketplace OpenSea Buys Ethereum Wallet Maker Dharma Labs;Decrypt
Top 3 Rebase Token Markets Shudder  Stats Show TIME OHM BTRFLY Lost Billions Since AllTime Highs;News.Bitcoin.com
HM Treasury Proposes New Legislation On Misleading Crypto Ads;Crypto Daily
Ravendex On A Mission To Become The First AMM Powered DEX On Cardano;ZyCrypto
Why Polygon Will Implement EthereumÉ??s EIP1559 Update;NEWSBTC
Street Fighter Releases Digital Collectibles on WAX Blockchain After Celebrating the 35th Anniversary;DailyCoin.com
Hopes Of XRP Getting Listed On Coinbase And Robinhood Spurred By Binance With wXRP Integration;ZyCrypto
State Street secures mandate for Raytheon Technologies CorporationÉ??s USbased DC assets;InstitutionalAssetManager
Microsoft to Acquire Activision Blizzard in $68.7 Billion Deal;Coinspeaker
FLX Distribution partners with Oasis;InstitutionalAssetManager
Bitcoin Price Back Down! Will the Next Correction bring prices to 30K?;CryptoTicker
Former procrypto CoC Brian Brooks to testify in a House hearing on the energy impacts of mining;Cointelegraph
Pareto Securities goes live with Broadridge frontoffice trading solution;InstitutionalAssetManager
Intel Set to Reveal EnergyEfficient Bitcoin Mining Chip;Decrypt
As we go through this again if you see someone talking about $MSFT April $310 calls being bought well they are clueless... ex...;Joe Kunkle
PKT Cash Unused Bandwidth Monetization Protocol Announces Bittrex Listing;CryptoGlobe
MOTION FOR A RESOLUTION on Political crisis in Sudan  B900682022;European Parliament (EP)
MOTION FOR A RESOLUTION on the situation in Kazakhstan  B900772022;European Parliament (EP)
MOTION FOR A RESOLUTION on the situation in Kazakhstan  B900772022;European Parliament (EP)
MOTION FOR A RESOLUTION on the Situation in Kazakhstan  B900652022;European Parliament (EP)
MOTION FOR A RESOLUTION on the situation in Kazakhstan  B900742022;European Parliament (EP)
MOTION FOR A RESOLUTION on the situation in Kazakhstan  B900742022;European Parliament (EP)
MOTION FOR A RESOLUTION on the Situation in Kazakhstan  B900642022;European Parliament (EP)
MOTION FOR A RESOLUTION on violations of fundamental freedoms in Hong Kong  B900762022;European Parliament (EP)
MOTION FOR A RESOLUTION on the political crisis in Sudan  B900812022;European Parliament (EP)
MOTION FOR A RESOLUTION on the political crisis in Sudan  B900812022;European Parliament (EP)
MOTION FOR A RESOLUTION on the political crisis in Sudan  B900802022;European Parliament (EP)
MOTION FOR A RESOLUTION on the situation in Kazakhstan  B900792022;European Parliament (EP)
MOTION FOR A RESOLUTION on the situation in Kazakhstan  B900722022;European Parliament (EP)
American Rapper Lil Baby On Holding Bitcoin And Ethereum Over Fiat;NEWSBTC
QANplatform Debuts First Ethereum Compatible QuantumResistant Blockchain Following Testnet Launch;ZyCrypto
Peckshield reports that Crypto.com hack netted $15 million;Crypto Daily
Interview: StellantisChef Carlos Tavares: Niemanden st«Ùrt es dass Opel jetzt Geld verdientÉ??;Handelsblatt
Early birds: U.S. legislators invested in crypto and their digital asset politics;Cointelegraph
Von wegen B«œrenmarkt: Aktueller BTCR«¨ckgang laut Analyst wie bei bisherigen BitcoinZyklen;Cointelegraph Germany
Animoca Brands Raises $358 Million in Latest Founding Round Valuation Spikes to Over $5 Billion;CoinCheckup Blog
«?NDERUNGSANTR«?GE 022-030 - VORSCHLAG F«?R EINE EMPFEHLUNG DES EUROP«?ISCHEN PARLAMENTS AN DEN RAT UND DIE KOMMISSION nach der Pr«¨fung von behaupteten Verst«Ù«?en gegen das Unionsrecht und Missst«œnden bei dessen Anwendung im Zusammenhang mit dem Schutz von Tieren beim Transport innerhalb und au«?erhalb der Union - B9-0057/2022(022-030)/REV1;European Parliament (EP)
«?NDERUNGSANTR«?GE 012-021 - VORSCHLAG F«?R EINE EMPFEHLUNG DES EUROP«?ISCHEN PARLAMENTS AN DEN RAT UND DIE KOMMISSION nach der Pr«¨fung von behaupteten Verst«Ù«?en gegen das Unionsrecht und Missst«œnden bei dessen Anwendung im Zusammenhang mit dem Schutz von Tieren beim Transport innerhalb und au«?erhalb der Union - B9-0057/2022(012-021)/REV1;European Parliament (EP)
MOTION FOR A RESOLUTION Violations of fundamental freedoms in Hong Kong  B900672022;European Parliament (EP)
MOTION FOR A RESOLUTION on violations of fundamental freedoms in Hong Kong  B900712022;European Parliament (EP)
MOTION FOR A RESOLUTION on the violations of fundamental freedoms in Hong Kong  B900732022;European Parliament (EP)
MOTION FOR A RESOLUTION on the violations of fundamental freedoms in Hong Kong  B900732022;European Parliament (EP)
MOTION FOR A RESOLUTION on violations of fundamental freedoms in Hong Kong  B900662022;European Parliament (EP)
«?NDERUNGSANTR«?GE 532-533 - BERICHT «¨ber den Vorschlag f«¨r eine Verordnung des Europ«œischen Parlaments und des Rates «¨ber einen Binnenmarkt f«¨r digitale Dienste (Gesetz «¨ber digitale Dienste) und zur «?nderung der Richtlinie 2000/31/EG - A9-0356/2021(532-533)/REV1;European Parliament (EP)
PKT Cash Unused Bandwidth Monetization Protocol Announces Bittrex Listing;Crypto News Flash
Telekommunikation: 91 Millionen Euro Maximalverg«¨tung: TelekomChef H«Ùttges soll deutliche Gehaltserh«Ùhung erhalten;Handelsblatt
PKT Cash Unused Bandwidth Monetization Protocol Announces Bittrex Listing;Bitcoinik
Blossom CapitalÉ??s Newly Launched $432 Million Fund to Focus on Crypto Startups;News.Bitcoin.com
«?NDERUNGSANTR«?GE 001-457 - BERICHT «¨ber den Vorschlag f«¨r eine Verordnung des Europ«œischen Parlaments und des Rates «¨ber einen Binnenmarkt f«¨r digitale Dienste (Gesetz «¨ber digitale Dienste) und zur «?nderung der Richtlinie 2000/31/EG - A9-0356/2021(001-457);European Parliament (EP)
CardaMart Private Sale Begins On 18th January 2022;ZyCrypto
Canada And The United States CrissCross Support For Nuclear Energys Bright Future;UraniumSqueeze - Reddit
Sports Betting Continues to Grow Thanks to Bitcoin and Cryptocurrencies;UseTheBitcoin
«?NDERUNGSANTR«?GE 517-519 - BERICHT «¨ber den Vorschlag f«¨r eine Verordnung des Europ«œischen Parlaments und des Rates «¨ber einen Binnenmarkt f«¨r digitale Dienste (Gesetz «¨ber digitale Dienste) und zur «?nderung der Richtlinie 2000/31/EG - A9-0356/2021(517-519)/REV1;European Parliament (EP)
«?NDERUNGSANTR«?GE 534-541 - BERICHT «¨ber den Vorschlag f«¨r eine Verordnung des Europ«œischen Parlaments und des Rates «¨ber einen Binnenmarkt f«¨r digitale Dienste (Gesetz «¨ber digitale Dienste) und zur «?nderung der Richtlinie 2000/31/EG - A9-0356/2021(534-541);European Parliament (EP)
«?NDERUNGSANTR«?GE 520-521 - BERICHT «¨ber den Vorschlag f«¨r eine Verordnung des Europ«œischen Parlaments und des Rates «¨ber einen Binnenmarkt f«¨r digitale Dienste (Gesetz «¨ber digitale Dienste) und zur «?nderung der Richtlinie 2000/31/EG - A9-0356/2021(520-521)/REV1;European Parliament (EP)
«?NDERUNGSANTR«?GE 547-551 - BERICHT «¨ber den Vorschlag f«¨r eine Verordnung des Europ«œischen Parlaments und des Rates «¨ber einen Binnenmarkt f«¨r digitale Dienste (Gesetz «¨ber digitale Dienste) und zur «?nderung der Richtlinie 2000/31/EG - A9-0356/2021(547-551);European Parliament (EP)
Plenardebatten  Montag 17. Januar 2022  Stra«?burg  Vorl«œufige Ausgabe;European Parliament (EP)
Microsoft Acquires Activision in Metaverse Push  Buying Enjin Next?;InsideBitcoins
Intel to give presentation on energyefficient Bonanza Mine Bitcoin ASIC next month;The Block
Credit Suisse Deutsche Bank UBS  drei europ«œische Grossbanken wechseln sich mit Pleiten Pech und Pannen ab;Neue Z«¨richer Zeitung (NZZ)
Decree allows further development at Russian ISL project;World Nuclear News
Kraken Daily Market Report for January 17 2022;Kraken Blog
A new dawn: Dusk Network Daybreak Testnet launches 1 February;Crypto Daily
Cudos and MELD Team Up for Better User Experience and Access to Cloud Mining Services;CoinCheckup Blog
Bitcoin Unmoved as England Enters the Fray While Baerbock Lands on Moscow;TRUSTNODES
The state of the cryptocurrency market  2022 predictions | Invezz;ChangeNOW_io
What is Crypto ETF and Where to Buy them?;CryptoTicker
Milo Launches First U.S. Crypto Mortgage;DailyCoin.com
«?NDERUNGSANTR«?GE 557-563 - BERICHT «¨ber den Vorschlag f«¨r eine Verordnung des Europ«œischen Parlaments und des Rates «¨ber einen Binnenmarkt f«¨r digitale Dienste (Gesetz «¨ber digitale Dienste) und zur «?nderung der Richtlinie 2000/31/EG - A9-0356/2021(557-563);European Parliament (EP)
we are still LONG $DWAC $75.25 anyone with me?#DWAC #trading #stocks;Shawn Catena
«?NDERUNGSANTR«?GE 527-531 - BERICHT «¨ber den Vorschlag f«¨r eine Verordnung des Europ«œischen Parlaments und des Rates «¨ber einen Binnenmarkt f«¨r digitale Dienste (Gesetz «¨ber digitale Dienste) und zur «?nderung der Richtlinie 2000/31/EG - A9-0356/2021(527-531);European Parliament (EP)
Belgian regulator says reactors could operate beyond 2025;World Nuclear News
$BBIG still liked the long but it felt like it would need a dip. Now in a halt and $5.60 level looms on reopen. https:t.coHnw...;Neal Roberts
«?NDERUNGSANTR«?GE 482-484 - BERICHT «¨ber den Vorschlag f«¨r eine Verordnung des Europ«œischen Parlaments und des Rates «¨ber einen Binnenmarkt f«¨r digitale Dienste (Gesetz «¨ber digitale Dienste) und zur «?nderung der Richtlinie 2000/31/EG - A9-0356/2021(482-484);European Parliament (EP)
Bitcoin minersÉ?? resilience to geopolitics  A healthy sign for the network;Cointelegraph
BlockÉ??s Cash App Integrates Lightning Network for Bitcoin Transactions;Decrypt
