EMPFEHLUNG F«?R EINEN BESCHLUSS keine Einw«œnde gegen die Delegierte Verordnung der Kommission zur Erg«œnzung der Verordnung (EU) 20212116 des Europ«œischen Parlaments und des Rates mit Vorschriften f«¨r die Zahlstellen und anderen Einrichtungen die Finanzverwaltung den Rechnungsabschluss Sicherheiten und die Verwendung des Euro zu erheben  B900592022;European Parliament (EP)
Bullish Times Ahead For Chainlink (LINK) Price, HereÉ??s What To Expect !;Coinpedia
$500000 Bitcoin Donation Prompts Renewed Investigation Into Capitol Hill Riot: Report;Decrypt
Kraken Daily Market Report for January 16 2022;Kraken Blog
DeFi Data Network Unmarshal Doubles Down on Solana Signs Key Advisor;CryptoGlobe
How to accept cryptocurrency if youÉ??re casino;NOWPayments
Axera Secures $126M for Semiconductor Production in New Funding Round from Meituan;Coinspeaker
Fuse Network: Streamlined Mobile Payments for Massive Crypto Adoption;ChangeNOW_io
Tonga akzeptiert BitcoinSpenden nach Tsunami;Cointelegraph Germany
Lending supply chain expertise to the India COVID relief effort;AlixPartners
ADALend Eyes Being Cardano Native Enables True Democratic Financial Solution;CoinQuora
Spain Sets New Rules to Govern Crypto Promotion∂ˇ;Coinspeaker
The Social Security Benefits Uprating Order 2022;United Kingdom Statutory Instrument
How Layer 2 Is Breathing New Life Into Legacy Blockchains & Expanding Their Reach;Crypto Daily
Crypto ATM Market Size Worth $1.88 Billion By 2028 | CAGR: 59.2%: Grand View Research Inc.;DailyCoin.com
METABLAZE Announces Phase One of Its Emerging Metaverse Ecosystem Roadmap with Token Presale;CryptoGlobe
Cryptocurrency Regulations: Why Legal Foundation is Key;CoinQuora
Walmart: Planning To Launch Cryptocurrency NFTs & Metaverse;Blockonomi
Bring your Project in Front of the Masses with the help of an IDO Launchpad;Crypto Daily
Charles Stanley appoints new CIO and Head of Research;InstitutionalAssetManager
Ethereum buyers are surging in the UK: Survey;Bitcoinik
Cardano Hits 3Week High Amid Flurry of Activity;Decrypt
Will This Event Turn Buy The Rumor Sell The News For Polygon? MATIC Price To Hit $3 This Weekend?;Coinpedia
C8 Technologies expands in Iberia with two new hires;InstitutionalAssetManager
ParallelChain: Blockchain Ecosystem With Public Mainnet & Private Networks;Blockonomi
The Social Security (Contributions) (Rates Limits and Thresholds Amendments and National Insurance Funds Payments) Regulations 2022;United Kingdom Statutory Instrument
Crypto Needs to Get Real About Compliance;Decrypt
How to Earn Passive Income While Hodling NFTs;CoinCheckup Blog
EBA publishes a Discussion Paper on its preliminary observations on selected payment fraud data under the Payment Services Directive;European Banking Authority (EBA)
$1.6 Billion Bitcoin Miner to IPO;TRUSTNODES
CardanoBased DEX SundaeSwap Announces Mainnet Launch Date ADA Jumps Over 20%;CoinCheckup Blog
Walmart files applications for the metaverse crypto & NFT;InsideBitcoins
Stacks Ecosystem Becomes #1 Web3 Project on Bitcoin;DailyCoin.com
Indonesian makes $1M out of selling NFT series on OpenSea;InsideBitcoins
Acting Comptroller of the Currency calls for collaboration in the crypto sector;InsideBitcoins
IOSCO consults on measures to address risks arising from digitalisation of retail marketing and distribution;International Organization of Securities Commissions (IOSCO)
DeFi Data Network Unmarshal Doubles Down on Solana, Signs Key Advisor;Coinspeaker
Everything You Need To Know About FRAX Shares;CryptoTicker
CoinMarketCap Lists Fake SHIB Addresses Gets Called Out;Crypto Daily
METABLAZE Announces Phase One of Its Emerging Metaverse Ecosystem Roadmap with Token Presale;Coinspeaker
DeFi Data Network Unmarshal Doubles Down on Solana Signs Key Advisor;CoinCheckup Blog
Most Hyped NFTs of 2022 You Must Check out;AirdropAlert
The First Daily Fees Sharing AMM On The Fantom Blockchain;ZyCrypto
ChingariÉ??s $GARI Token To Make Historic Debut On 6 Top Crypto Exchanges;UseTheBitcoin
ChingariÉ??s $GARI Token To Make Historic Debut On 6 Top Crypto Exchanges;Crypto News Flash
New Strategic Partner for CheersLand: Medabots;CryptoNewsZ
ChingariÉ??s $GARI Token To Make Historic Debut On 6 Top Crypto Exchanges;CoinFunda
Activision Pushes Out Dozens of Staff Over Misconduct;Wallstreet Journal (WSJ)
Cardano Enters Basho Phase: What Should We Expect from the Network Upgrade?;DailyCoin.com
Polygon (MATIC) Set to Become Deflationary with EIP 1559 Deployment;DailyCoin.com
SEC Proposes Major Rule Changes on Trading Plans and Corporate Buybacks;Harvard Law School
Mars4 Metaverse NFTs Are Selling Rapidly Over $250K Raised In A Day;ZyCrypto
The Major Sporting Events (Income Tax Exemption) (UEFA WomenÉ??s EURO 2022 Finals) Regulations 2022;United Kingdom Statutory Instrument
How This 22YearOld Indonesian Became A Millionaire In Just 5 Days By Converting Selfies Into NFTs;ZyCrypto
Banks will be sidelined by CBDCs  They will need to embrace crypto;Crypto Daily
Chingari token $GARI becomes the first crypto to list on six top exchanges at a go;ZyCrypto
"Es geht um den globalen Wettlauf um Macht und ... digitalen Darwinismus"". Global CIO Equity Virginie Maisonneuve «¨ber China ...";Allianz Global Investors
ChingariÉ??s Social Token GARI is Getting Listed on OKEx Following Exclusive IEO For South Asian Users;CoinCheckup Blog
BitcoinZahlungen gehen zur«¨ck: Andere Kryptow«œhrungen h«œufiger verwendet;Cointelegraph Germany
Tonga to accept Bitcoin donation amid volcanic shock wave;Bitcoinik
The Occupational Pension Schemes (Collective Money Purchase Schemes) Regulations 2022;United Kingdom Statutory Instrument
METABLAZE Announces Phase One of Its Emerging Metaverse Ecosystem Roadmap with Token Presale;UseTheBitcoin
METABLAZE Announces Phase One of Its Emerging Metaverse Ecosystem Roadmap with Token Presale;Crypto News Flash
METABLAZE Announces Phase One of Its Emerging Metaverse Ecosystem Roadmap with Token Presale;CoinCheckup Blog
Tesla Boost is Now Nearly Erased;
Cardano surpasses Ethereum in transaction volume ADA shoots up 13%  hereÉ??s why;Crypto News Flash
Unilever Sets Out Ambition to Expand in Health Products;Wallstreet Journal (WSJ)
B«Ùrsengang: Cheplapharm soll den Anfang machen;Frankfurter Allgemeine Zeitung (FAZ)
É??IndiaÉ??s TikTokÉ?ù Chingari lists token on six top exchanges after a $15 million Series A funding;Crypto Daily
Michael Saylor giveaway scam by impersonator strips Bitcoin investors for $1.1 million;Crypto News Flash
OlympusDAOs OHM Token Tanks 30% Amid ProfitTaking Liquidations;Decrypt
Walmart Is Entering The Metaverse;Crypto Daily
Stellar Network is the #3 Coin to Watch for the Week of January 17  January 23 2022;CoinCheckup Blog
Looking for Value  The Crypto Growth Opportunities in 2022: SafeMoon Shiba Inu Bitgert HUH Token and ApeBUSD;CryptoNewsZ
VikiCoin: Revolutionizing The Internet Marketplace With Crypto;ZyCrypto
El Salvador set to build central AmericaÉ??s first wave park the Bitcoin beach;Crypto News Flash
NFT Platform OpenSea Hits Record $3.5B in Monthly Ethereum Volume;Decrypt
Sothebys will accept crypto for largest diamond ever auctioned;Crypto Daily
USD Coin Overtakes TetherÉ??s USDT as the Largest Stablecoin on Ethereum;CoinCheckup Blog
GBP1tn of UK pension money now committed to robust net zero;InstitutionalAssetManager
The Cardano Network Welcomes the Metaverse;CryptoNewsZ
Singapore bars crypto service providers from advertising in public spaces;Cointelegraph
Top five pro tips for designing agile hybrid workplace;Capgemini
EBA confirms the continued application of COVID19 related reporting and disclosure requirements until further notice;European Banking Authority (EBA)
MetaConcert MegaFlop;ZebPay
ADA Price Prediction  Cardano Price shoots 30% in the past Week! Thank you Basho?;CryptoTicker
Why You Need to Read the FCAÉ??s Market Watch;Shield
Tory Lanez Is Releasing His NFT Collection With Decentar Labs;ZyCrypto
Biden to continue push for voting rights bill as he honors Kings legacy;Reuters
Is Crypto Following a Familiar Pattern?;Finance Magnates
FCA fines UK finance firms GBP568m in 2021 in response to surge in pandemiccharged financial crime;InstitutionalAssetManager
Best NFT Airdrops and Giveaways for February;Coindoo
Cuprum Coin Signs Listing Contracts With 3 Exchanges Market Launch In FebruaryMarch;ZyCrypto
Panteras Capital PLC: BaFin prohibits Panteras Capital PLC from offering the shares of Panteras Capital PLC to the public;Bundesanstalt f«¨r Finanzaufsicht (BaFin)
Former Thai SEC chief lays out three critical issues with crypto taxations;Cointelegraph
Request surged 24% in the last 24 hours: best places to buy Request now;CoinJournal
South Korean Movie Industry Embraces NFTs by Offering Merchandise and Collectible Tickets;Blockchain News
CBDCs and stablecoins: EY advises banks to É??prepare for whatÉ??s comingÉ??;Cointelegraph
Pandemic prompts major shift in asset allocation investment risk exposures and ESG practices;InstitutionalAssetManager
Barings appoints Real Estate Country Head  France;InstitutionalAssetManager
Top 5 Fiat Currencies That Compete With Bitcoin;CryptoTicker
Why Cardano Proves To Be The Crypto To Watch In 2022 As Transaction Volume Skyrockets;ZyCrypto
Software Provider Lukka Raises $110M in Series E at $1.3B Valuation;Blockchain News
Singapore curbs crypto marketing in digital asset crackdown;The Block
AMENDMENTS 509-514 - REPORT on the proposal for a regulation of the European Parliament and of the Council on a Single Market For Digital Services (Digital Services Act) and amending Directive 2000/31/EC - A9-0356/2021(509-514);European Parliament (EP)
MATIC And FTM Race To Power The DeFi Ecosystem! This Is Why BTC And ETH Will Underperform!;Coinpedia
Bitcoin Price Consolidates, BTC Price Predicted To Surge 30% ! HereÉ??s When;Coinpedia
AMENDMENTS 542-546 - REPORT on the proposal for a regulation of the European Parliament and of the Council on a Single Market For Digital Services (Digital Services Act) and amending Directive 2000/31/EC - A9-0356/2021(542-546);European Parliament (EP)
AMENDMENTS 527-531 - REPORT on the proposal for a regulation of the European Parliament and of the Council on a Single Market For Digital Services (Digital Services Act) and amending Directive 2000/31/EC - A9-0356/2021(527-531);European Parliament (EP)
AMENDMENTS 547-551 - REPORT on the proposal for a regulation of the European Parliament and of the Council on a Single Market For Digital Services (Digital Services Act) and amending Directive 2000/31/EC - A9-0356/2021(547-551);European Parliament (EP)
AMENDMENTS 557-563 - REPORT on the proposal for a regulation of the European Parliament and of the Council on a Single Market For Digital Services (Digital Services Act) and amending Directive 2000/31/EC - A9-0356/2021(557-563);European Parliament (EP)
AMENDMENTS 532-541 - REPORT on the proposal for a regulation of the European Parliament and of the Council on a Single Market For Digital Services (Digital Services Act) and amending Directive 2000/31/EC - A9-0356/2021(532-541);European Parliament (EP)
TA: Why Ethereum At Risk of Fresh Decline $3200 Holds The Key;NEWSBTC
Studie: Stellenanzeigen f«¨r Krypto in 1 Jahr um fast 400% gestiegen;CryptoMonday
Walmart the Latest Giant To Enter the NFT Metaverse Sector;TheNewsCrypto
Elliptic launches market intelligence unit and announces new proposition for crypto traders;InstitutionalAssetManager
5 Reasons You Should Use a Bitcoin ATM;Coinratecap
Resilience of Cryptocurrencies Expected in 2022 as AsiaPacific Market Is Believed to Remain Dominant;DailyCoin.com
AMENDMENTS 505-508 - REPORT on the proposal for a regulation of the European Parliament and of the Council on a Single Market For Digital Services (Digital Services Act) and amending Directive 2000/31/EC - A9-0356/2021(505-508);European Parliament (EP)
GG Dapp Is Disrupting the Blockchain Gaming Community;CryptoNewsZ
Transforming the retail experience with frictionless supply chain;IBM
AMENDMENTS 517-521 - REPORT on the proposal for a regulation of the European Parliament and of the Council on a Single Market For Digital Services (Digital Services Act) and amending Directive 2000/31/EC - A9-0356/2021(517-521);European Parliament (EP)
Walmart prepares for the Metaverse plans its own cryptocurrency and NFT collection;Crypto News Flash
Former Twitter CEO reconfirmed the work on a decentralized Bitcoin mining system;Bitcoinik
KonamiÉ??s Castlevania Anniversary NFT Sale Raises Over $160K;News.Bitcoin.com
BTC Hash Rate Hits a New AllTime High;Finance Magnates
N.Koreas Crypto Hacks Up by least 7 times in 2021 Nearly $400M Stolen: Chainalysis;Blockchain News
Curtis Sword Becomes the First Blockchainbased LargeScale 3D ARPG;CoinQuora
Total Fees Paid on Bitcoin Network Hit Monthly Low Hashrate Records Historic Highs;Blockchain News
Kishimoto Inu Is Set to Become the Anime Hub of the Blockchain Ecosystem With the Launch of Kishiswap 2.0;CoinQuora
Dogecoin (DOGE) Price Falls 5.5% After Brief Rise Following Musk Tweet;TheNewsCrypto
Filings revealed Walmart planning to enter in crypto & Metaverse;Bitcoinik
Fidelity Report: Countries That Become Early Bitcoin Adopters Will Be É??Better OffÉ??;CryptoGlobe
The WorldÉ??s First Decentralized Bond Market Has Arrived;NEWSBTC
SkyArk The RPG of Play And Earn Gaming;CoinQuora
GemUni Disrupts Crypto Gaming With the Decentralized NFTs Gaming Platform for Play to Earn;News.Bitcoin.com
 Bitcoin Outperforming Major Assets | This Week in Crypto  Jan 17 2022;99Bitcoins
Bitwise CIO Lays Out Argument for Bitcoin ETF Coming in 2022;CryptoGlobe
Fidelity strategists say more countries will buy Bitcoin;Bitcoinik
Rio de Janeiro mayor to invest 1% of city reserves into Bitcoin;InsideBitcoins
Pope FrancisÉ??s Pontifex Carpet Gift Sold as NFT for Charity Purpose in Afghanistan;Blockchain News
Fidelity Expects More Countries to Acquire Bitcoin Citing É??Very High Stakes Game TheoryÉ??;News.Bitcoin.com
BlockchainInvestments: «¨ber den Bitcoin hinausblicken;Neue Z«¨richer Zeitung (NZZ)
Stacks blockchain emerges as top Web 3 project on Bitcoin;InsideBitcoins
Legendary Boxer Mike Tyson Bullish on Solana ($SOL) After Going É??All InÉ??;CryptoGlobe
Bitcoin (BTC) Price Prediction: BTCUSD Is in a Range Lacks Buyers at Higher Levels;InsideBitcoins
Hong Kong Resumes Discussion on Stablecoin Regulation Offering 5 Options to the Public;Blockchain News
$NEAR Surges to New AllTime High Above $20 After NEAR Foundation Raises $150M;CryptoGlobe
TA: Bitcoin Price Consolidates Why Break above $43.5K Is The Key;NEWSBTC
"Lots and lots of good stuff coming out next year.""Our MD Keith Bowes joined ASXInvest to discuss our Kayelekera project &...";Lotus Resources Limited
EthereumÉ??s Network Revenue Shot up by 1777% Last Annual Year;Blockchain News
Boxing Legend Mike Tyson Says HeÉ??s É??All inÉ?? on Solana Crypto  Asks Fans How High SOL Will Go;News.Bitcoin.com
Microsoft Warns of Cyber Attack on Ukrainian Computer Networks;New York Times (NYT)
XRP Price Eyeing Massive Rally! XRP Better Performing Than BTC Says Analyst;Coinpedia
Custom 1951 Mercury Sells at Auction for $1.95 Million;New York Times (NYT)
Robinhood on Listing More Cryptocurrencies: É??ItÉ??s Important That We Get a Bit More Clarity From RegulatorsÉ??;News.Bitcoin.com
Hong Kong Monetary authority to regulate stablecoins;Hogan Lovells
Bitcoin Aid Reaches Tsunamihit Tonga When Communication Lines Are Down;CryptoPotato
OpenSea Scores ATH of $3.5B in Monthly Ethereum Trading Volume;CryptoPotato
OnChain Data Shows Number of ETH Holders At AllTime High;CryptoPotato
Binance to Establish a Crypto Exchange in Thailand (Report);CryptoPotato
Singapore Urges Local Crypto Companies to Refrain From Promoting Digital Assets: Report;CryptoPotato
SpainÉ??s Regulator Sets New Rules for Cryptocurrency Advertisement;CryptoPotato
SothebyÉ??s to Accept Crypto for a 555Carat Black Diamond (Report);CryptoPotato
BTC Worth $1.1 Million Sent to a Confirmed Michael Saylor Giveaway Scam;CryptoPotato
Phemex Steals the Show as the Metavers Puts a Spotlight on Blockchain;CryptoPotato
What UK employees need to know about income protection insurance;Insurance Business UK
NGOs take UK Government to Court in relation to Net Zero Strategy;Linklaters
European Commission proposes new directive to crack down on environmental crime;Linklaters
Belgian Parliament votes in favour of recognition of crime of ecocide at national and international levels;Linklaters
LCH achieves record clearing volumes in 2021;LCH Group
Top ten challenges for whitecollar crime and investigations lawyers in 2022;Allen & Overy
Article: Corporate Criminal Offence: Top 10 FAQs;BDO
NFTs and BlockchainBased Games on the Rise Despite the Recent Crypto Decline (Report);CryptoPotato
Company Law  A Real Entity Theory;Oxford Business Law School
Crypto Market Forecast: Week of January 17th 2022;Brave NewCoin
Bundesfinanzminister Christian Lindner im Interview mit der Welt am Sonntag;Bundesministerium f«¨r Finanzen (BMF)
REACTEU: É?™382.7 million to help Spain's regions fighting the coronavirus pandemic and supporting a digital and green transition;European Commission (EC)
John C Williams: Reading the recovery;Bank of International Settlements (BIS)
Rekha Chifuwe Mhango: 2021 findings of the private sector foreign investment and investor perception survey;Bank of International Settlements (BIS)
Benjamin E Diokno: Message  73rd Inaugural Meeting of the Management Association of the Philippines;Bank of International Settlements (BIS)
Verordnung des Bundesministers f«¨r Soziales Gesundheit Pflege und Konsumentenschutz betreffend die Festlegung von Pr«œparaten im Sinne des Sterbeverf«¨gungsgesetzes (Sterbeverf«¨gungsPr«œparateV  StVfPr«œpV);Rechtsinformationssystem des Bundes (RIS)
Resoluci«¸n de 27 de diciembre de 2021 de la Universidad de Santiago de Compostela por la que se publica el plan de estudios de M«≠ster Universitario en Tecnolog«as en Marketing y Comunicaci«¸n Pol«tica.;BOE - Bolet«n Oficial del Estado
Cardano IDO LaunchPad É??CoollaunchÉ?ù Records Buzzing Progress as it Sells Out Over 11% Of $COOL Tokens Within Days;ZyCrypto
This Week on Crypto Twitter: NBA Stars Buy Bitcoin Vitalik Welcomes Trolls FWB DAO Ejects a CoFounder;Decrypt
Jack DorseyÉ??s Payments Company Is É??Officially Building an Open Bitcoin Mining SystemÉ??;News.Bitcoin.com
Retail Giant Walmart Plans To Create Its Own Cryptocurrency And Collection of NFTs;ZyCrypto
É??AWS for Web3É?? Pocket Network Shakes Up Infrastructure of the Internet;News.Bitcoin.com
Daily Thread  January 17 2022;UraniumSqueeze - Reddit
Sports NFT Marketplace Lympo Suffers An $18.7 Million Hack;NEWSBTC
Ripple Price Prediction: XRPUSD Must Reclaim $0.80 to Move Higher;InsideBitcoins
Supply Chain Woes Could Worsen as China Imposes Covid Lockdowns;New York Times (NYT)
BitcoinHashrate unbeirrt auf Rekordhoch  Jack Dorsey sorgt f«¨r Euphorie;Cointelegraph Germany
Ethereum Price Prediction: ETHUSD Gets Rejected;
The Ultimate Poloniex Review;CoinStats Blog
According to Max Keiser soon 50% of the worlds energy will be used to mine #Bitcoin the only safe investment. People should pu...;Peter David Schiff
Crypto Loans & Top Crypto Lending Platforms;CoinStats Blog
FinTech Scotland Celebrates 5th Year Showcased Remarkable Growth Since Debut;TheNewsCrypto
Elon Musk And Tesla Reignite Hopes Of Dogecoin Reaching $1 In 2022 As Rumors Of A Starlink Collaboration Swell;ZyCrypto
Kraken Daily Market Report for January 15 2022;Kraken Blog
Joe Rogan Holds High Hopes For The Cryptocurrency Industry;NEWSBTC
É??80% Of The Investments That I Make Are In Or Around Cryptocurrencies.É?ù Asserts Mark Cuban;ZyCrypto
Tezos Price Prediction  How Much Will XTZ Be Worth in 2022?;TheNewsCrypto
$2.5 Billion in NFT Sales This Week Volume Climbs 161% Meebits NFT Sales Surge;News.Bitcoin.com
What is The Sandbox (SAND)?;UseTheBitcoin
Jack Dorseys Block commits to build an open bitcoin mining ecosystem;The Block
Bitcoin Price Prediction: BTCUSD Bears May Run Out as Bulls Focus at $44000;InsideBitcoins
Fantom Heads Towards a Massive Recovery, New ATH Incoming for FTM Price!;Coinpedia
Top 5 Cryptocurrencies of the Week (Week 2);CryptoTicker
The Shark Tank Star , Mark Cuban Includes These Altcoins In His Portfolio !;Coinpedia
Top 5 Altcoins Traders Can Bet On This Year! Analyst Charts Next Level;Coinpedia
XYO (XYO) Price Predictions for 20222030;Crypto Blog by Changelly
$ALGO: SkyBridge Capital Founder Calls Algorand É??The GoogleÉ?? of Crypto;CryptoGlobe
Everything You Need To Know About The Web3.0;CryptoTicker
M&APE Quarterly;Harvard Law School
Climate Diversity and Control: 2022 ISS Proxy Voting Guidelines;Harvard Law School
El SalvadorÉ??s Bitcoin Use Adds To Its Risk Portfolio Says Top Credit Rating Firm;ZyCrypto
Private sector working group on euro riskfree rates publishes recommendations on EURIBOR fallbacks;European Central Bank (ECB)
HereÉ??s Why SOL, LTC, DOGE & MATIC Price Poised For Major Gains;Coinpedia
$ADA: How Cardano Is Being Scaled in 2022;CryptoGlobe
Outbrain Shuns Crypto;TRUSTNODES
Bitcoin is É??a tool for social justiceÉ??: exFed official;CoinJournal
